Unnamed: 0,IdPost,Thread,Content Cleaned,Label,Sentiment
2000,59198182,6029821,"   
Ling is a woman ;)",0,0
2001,59187072,6028722,"Those girls need direction method how to earn 10k$/month from ewhoring.
She should visit HF marketplace. Lol",0,0
2002,59186632,6028722,"I don't watch much twitch but the other day found a stream of a girl on a treadmill with nice big breasts that anyone is going to comment on and her number one rule is no talking about her breasts. 

WTH",0,0
2003,59186396,6028722,"   
Totally agree with it.

A good thing to see less of these girls and more of real gaming girls, which are really skilled and even play in competition",0,0
2004,59186380,6028722,All these girls know what they are doing.,0,0
2005,59186366,6028722,"These girls were banned from twitch because they were ""too hot"".


   ",0,0
2006,59187819,6028722,"   
Except, Twitch is for gamers. These girls aren't profiting off their gaming skills or game streaming. They belong on Chaturbate.",0,0
2007,59187107,6028722,"these girls are filling a demand.

what r u guys, communists ???",0,0
2008,59191785,6028722,"who cares, they should be on bongacams not twitch.
fugg them

   
looks like the girl i've seen in Amsterdam red light district. 
TOtally cheap whore, she didnt gave me her name but Id which she goes under its (820924).",0,0
2009,59191025,6028722,They were doing Twitch Ewhoring LOL. Girls these days..,0,0
2010,59190895,6028722,"Lmao That site is so biased. That one chick yeeted her cat over her head & that’s not animal cruelty?

Special privileges because the girls bring in majority of the money by being sexual on that site “Body painting” Shameless. Should be on pornhub not a gaming streaming site. Not all girls on there ofc.",0,0
2011,59190116,6028722,Who is the girl at the very beginning of the video?,0,0
2012,59187886,6028722,"They belong on chaturbate and not twitch.

In fact, I wouldn't be surprised if some of them actually are on chaturbate, or any of the other camgirl sites.",0,0
2013,59200208,6028722,"women gamers make good money, try to change gender and start playing games.",0,0
2014,59192895,6028944,"Webcams don't matter much my girl streams without a webcam and does fine. 
Right now is a good time to start since twitch just started paying affiliates ad revenue. 

Just try to be entertaining and even if you get 20 views per stream everyday your bound to make around $20-30 a month even at low views, given you can't cash out until you reach $100.

Best bet is strive to get affiliate it's pretty easy for the most part then just stream a few hours a day and you'll be golden.",0,0
2015,59196191,6029614,"Checking in for today!

Got a few nice and fun plans for today while on vacation, maybe I'll try and pickup a Tinder date for the ride.
Literally just some nice cute chick who's down for a small little road trip and star-gazing type stuff, that'd be really fun where I'm at right now.
Oh and I also just saw one of the most beautiful girls in my life the other day at some thrift store, she had a sleeve of tattoos on her right arm (same as what mines going to be) and a killer body, but overall just a ""holy sh*t who are you?!"" face. Too bad she was with her boyfriend lol. I did hear them fighting though as they were walking out to their car, he seemed like a wicked controlling guy and the type to snap at everything she does because she's attractive, and he just looks like the typical washed up bud dealer from high school who never changed his fashion style. If I had known there were tensions, I most likely would've slid my number to her at some point because why the fugg not.

91/100",0,0
2016,59198278,6029614,"December 02

1804
Napoleon Bonaparte was crowned emperor of France in Paris by Pope Pius VII.

1823
President James Monroe outlined his famous doctrine opposing European expansion in the Western Hemisphere.

1859
Abolitionist John Brown was hanged for his raid on Harper's Ferry.

1942
The first controlled nuclear chain reaction was demonstrated at the University of Chicago.

1954
The Senate voted to condemn Republican senator Joseph R. McCarthy of Wisconsin for ""conduct that tends to bring the Senate into dishonor and disrepute.""

1970
The Environmental Protection Agency (EPA) was established.

1982
Barney B. Clark became the first person to receive an artificial heart in a transplant operation.

1988
Benazir Bhutto was sworn in as the Prime Minister of Pakistan, becoming the first woman to head an Muslim nation.

1990
Composer Aaron Copland died at age 90.

1999
A Protestant and Catholic cabinet convened for the first time in Northern Ireland.

2001
Enron Corp., under CEO Kenneth Lay, filed for bankruptcy.",0,0
2017,59191159,6026933,"Massachusetts - Boston, MA

- seasons change from summer to fall to winter back to spring/summer
- TONS of snow depending on the year and how much you get
- legal weed, both medicinal and recreational / Hemp-Fest which takes place every year
- we gaht the best accents in all of America don't even fahkin' try me kehd
- the people Boston and MA in general breed are tough, funny, spunky, overall unique characters
- our girls are straight up smokes
- Boston has Top of the Hub which is a legit an internationally known restaurant
- the best seafood in all of America hands down
- LOBSTAH KEHD
- the best sports teams in all of America ( i mean actual best ) - New England Patriots / Boston Celtics / Boston Bruins / Boston Red Sox

This list would just keep going on an on and never stop, so you get the point. :P",0,0
2018,59193018,6029340,"   
LOL I mean it is identity theft so it is pretty wrong in that sense.... Do the girls in the pictures know that their photos are being used for this purpose? Some probably do, some don't, and others probably don't care. It's not like they are getting a percentage of the sales though anyways.

Seems that everyone has a very different opinion on this topic.",0,0
2019,59193000,6029340,"   
So its not scamming because a scam is where you just take their money and don't give them anything in return...? 

definition:

   

Identity fraud = illegal, and you're tricking these dudes into thinking you're that girl no?

Curious to see your response.",0,0
2020,59191009,6029080,"Jack Dorsey doesn’t eat anything in the morning. Instead, he meditates for two hours, he takes an ice bath, and drinks a lot of water. He doesn’t eat anything for lunch, either. After subsisting on water all day, Dorsey consumes a dinner of proteins, greens, and mixed berries between 6:30-8:30pm, as the Twitter CEO explained on the Ben Greenfield Fitness podcast in April.

If Dorsey were a woman, we might call this disordered eating. But because he’s a man—and a powerful one in the tech industry—we call it “optimizing.”

For decades, women, especially those in the public eye, bore the brunt of unrealistic beauty standards, which caused many to develop or exacerbated unhealthy relationships with food. Actress and Goop founder Gwenyth Paltrow reportedly ate 300 calories a day during a January 2018 detox regimen; reality TV star Nicole Richie admitted that she “liv  on a diet of sunflower seeds, celery juice, and chewing gum.” Just this week, Today Show hosts Jenna Bush Hager and Hoda Kotb weighed themselves on live television after spending a week only eating between 10am and 6pm, with the intention of losing weight and improving “brain health, and energy and skin.”

When these prominent women share their regimens, the public and media outlets accuse them of disordered eating, in the process normalizing the kinds of body images that have driven millions of women to develop eating disorders of their own.

But in recent years, high-profile men have begun to publicly divulge their eating habits, not as a way to meet a standard, as women feel they must, but to show how they exceed one.

That is, many famous men have attributed their success to an “optimizing” regimen of intermittent fasting. In 2013, actor Hugh Jackman revealed his intermittent-fasting plan that involved an eight-hour window to eat, followed by 16 hours of fasting. Phil Libin, the former CEO of Evernote, explained his decision to fast for up to 8 days at a time, attributing his lack of excitement about his work to his carbohydrate intake. In 2016, tech entrepreneur Kevin Rose decided to cash in on the trend and created Zero, an app intended to help users track their fasting regimens.

For decades, the stigma surrounding eating disorders put women at risk. Today, men who adopt these practices in efforts to enhance mental clarity and boost energy levels (and with little scrutiny towards the scientific backing of intermittent fasting) run the same risk of sliding into dangerous eating practices without even knowing it.


    ",0,0
2021,59191169,6029080,"November 28

1520
Portuguese explorer Ferdinand Magellan passed through the strait which bears his name to the Pacific ocean.

1919
American-born Lady Astor became the first woman to take a seat on the British Parliament.

1942
Almost 500 people died in the Coconut Grove nightclub fire in Boston.

1943
Churchill, Roosevelt, and Stalin met in Tehran for their first meeting during World War II.

1964
The U.S. spacecraft Mariner 4 launched—on its way to the first successful mission to Mars.

1990
Margaret Thatcher resigned as prime minister of Great Britain; John Major took over.",0,0
2022,59155738,6025852,"I was just at NY 2 weeks ago let me tell you the one and only mistake was renting a car guessing you want to see the city it's hard af to get parking and when you do most liekly your at a parking lot and your renting a spot for $10-20 a hour its crazy and $50 for the whole day like it some deal lol. I won't forget my dad wanting turning right to go on the bridge and it was green but we stopped cause so many people were crossing and a car behind use was honking at him like 1000x times my dad like tf you want me to do run these people over. As he steps out he like tf you want me to do Bit** guy says move when you got a small gap you had 4 chances these gaps where hella small but I guess that how NY people drive so yeah unless you wanna deal with people honking at you 24/7 just use a uber or train you save a lot on money and the headache.

Enjoy my story (=

edit - Also be careful with your stuff I literally saw a girl get her purse snatched and that dude ran dumb fast.",0,0
2023,59189938,6029018,"   
I would just would have to turn off the light switch and imagine one of the girls I was banging in my younger years.",0,0
2024,59189935,6029018,"Yeah, the lady at the Taco Bell drive-through called me ""sweetheart"" last week.",0,0
2025,59189669,6029018,"I work for Amazon and now, whenever I deliver something Age 18+ we MUST ask for ID even if it's an 80 year old women taking the parcel. Everytime I ask I get the middle aged women seeming flattered that I think they're not 18. I even tell them I ASK EVERYBODY!",0,0
2026,59189627,6029018,"A nice unintended compliment yesterday. 

I decided to get a packet if cigarettes (tensions high lately), to which the lady behind the counter had said ""You look young, do you have ID?"".

The law in this country is if you look under 25, they ask for ID.

Good to know that I'm almost 30 and look under 18    


Anyone received any nice compliments this week?",0,0
2027,59190917,6029018,"U got this wrong jelly.

looking young is positive if ur female, its not preferable for most males.",0,0
2028,59191902,6029018,This happens to me like 2-3 times a year when I buy alcohol and I’m a woman in my 30’s and I rather find it annoying than flattering. I think it’s the the cashier’s way of bullying.,0,0
2029,59189006,6028861,"November 28

1520
Portuguese explorer Ferdinand Magellan passed through the strait which bears his name to the Pacific ocean.

1919
American-born Lady Astor became the first woman to take a seat on the British Parliament.

1942
Almost 500 people died in the Coconut Grove nightclub fire in Boston.

1943
Churchill, Roosevelt, and Stalin met in Tehran for their first meeting during World War II.

1964
The U.S. spacecraft Mariner 4 launched—on its way to the first successful mission to Mars.

1990
Margaret Thatcher resigned as prime minister of Great Britain; John Major took over.",0,0
2030,59188164,6028818,"   
I've asked for a pair of blue light blocker glasses for Christmas. Has anyone tried a pair similar to these?

ANRRI Blue Light Blocking Glasses for Computer Use, Anti Eyestrain Lens Lightweight Frame Eyeglasses, Black, Men/Women    ",0,0
2031,59185931,6028601,"Happy Thanksgiving!

November 28

1520
Portuguese explorer Ferdinand Magellan passed through the strait which bears his name to the Pacific ocean.

1919
American-born Lady Astor became the first woman to take a seat on the British Parliament.

1942
Almost 500 people died in the Coconut Grove nightclub fire in Boston.

1943
Churchill, Roosevelt, and Stalin met in Tehran for their first meeting during World War II.

1964
The U.S. spacecraft Mariner 4 launched—on its way to the first successful mission to Mars.

1990
Margaret Thatcher resigned as prime minister of Great Britain; John Major took over.",0,0
2032,59185889,6028657,"   
lol I think you don't understand.
of course she's a girl ! they have only verfied models on this website and you can order some request to them.
that's what I did with this girl,and the first time she did everything I said.",0,0
2033,59185853,6028657,"   
I don't even know what e-whoring was I had to google it.
I'm stupid cause I let this girl fool me but I know this was a real girl lol",0,0
2034,59185802,6028657,"   
yeah of course I know it sounds completely stupid !
but honestly I like the fact that you can ""control"" a girl just with money. well in that case I didn't control anything to be honest...",0,0
2035,59185933,6028657,"   
twas me...j/k. I’m a girl and I never scam.",0,0
2036,59179252,6028054,what do we want? a girl worth fighting for.,0,0
2037,59181678,6028204,"   
Thanks, even tho the guy/girl above is right. I should have known at least the thing about double posting.",0,0
2038,59179830,6028122,"Hey guys, I know there are many successful members on hack forums that have made quite a fortune for themselves. I know that there are many others with great ideas who just need capital to jump start whatever they have store in their minds. I recently came across an inheritance of 250k~. I am currently in no debt. It is currently sitting in a bank giving about 3% return a year. I want to be able to do something with this amount and make it greater than it already is. I am looking for advice, on what members here would do with that amount if they came across it. I am looking for some HQ replies and ideas, not ""spend it on drugs/women"".
I really appreciate it guys, thank you.",0,0
2039,59175433,6027643,"   
Basically the same.

In order: 

1. Buy real estate as an investment
2. Quit my job without 2 weeks notice, I don't give a flying f**k
3. Holidays with my family for a long time
4. Buy their dream home and mine
5. Find a girl and get married but don't let your girl know you won the lotto
6. Buy super sport bikes and cars
7. Invest more",0,0
2040,59177254,6027788,"Checking in 

Interesting Fact: 
Mister Rogers would narrate himself feeding the fish each episode with, 'I’m feeding the fish,' because of a letter he received from a young blind girl who was worried the fish were hungry.",0,0
2041,59178819,6027684,Oh damn. That's not surprising though. Most girls would have a problem with it. Luckily mine let me continue to do it when she found out. Asking her for her pics was a no no though. lol,0,0
2042,59177793,6027790,I've used similar apps in the past. It's an easy bang but it's also a great way to meet the crazy ones who have also got high body counts. Very very few high quality Women use such apps in my experience.,0,0
2043,59177753,6027790,"I have like 400+ matches and only f*cked one girl off tinder. 
Seems to me all I match with are people that are over weight, and when It is someone who is actually good-looking they don't even respond or they're just dry.",0,0
2044,59177714,6027790,"   
Maybe there's just dif locations because where i live every girl is down to fugg if you have your Clay Davis together lol",0,0
2045,59176796,6027790,"   
Just hit 30, been with the same girl for 3 years... Game over for me LOL",0,0
2046,59176116,6027790,"i've been using it for 1 month and no cap i've been catching hella bodies i went from having 11 bodies
and then i downloaded tinder and started finessing these girls saying you love them and Clay Davis and of course
you gotta act like hella matured or whatever take them out for a date but its worth it but it depends on
how you make your moves and nowadays it's all about no looks no cap if you got the looks and money you set to be a manwhore",0,0
2047,59173642,6027506,im the real shady slim yes im da real Shim Slady,0,0
2048,59171956,6026866,"I could do it no problem

I tasted a few MRE's and they were alright, the meatloaf one was horrible.

   
Well yea they are designed for the men and women in service so they have to pack higher calories for energy. 

Those who are in the military burn more calories then the average person so it makes sense. 

I only tried USA MRE's but some of the Japanese and Chinese ones look good",0,0
2049,59169854,6027066,"Currently only English for read / write / speak. 

I'm white but I only really have 3-4 white friends. The rest are Pakistani or Indian. I'm slowly learning Hindi and Gujarati. Mainly because A) 2 of the Paki guys keep telling me to learn Hindi and B) I just met an Indian girl on a dating site who speaks Gujarati and Hindi.

EDIT: I see people mentioning duolingo. Is it free?",0,0
2050,59173792,6027568,"The quotation of Donald Trump said enough. He had a taste for lovely women although the majority was a bit on the 'younger side'. 
This was the exact quote:
""It’s even said that he likes beautiful women as much as I do, and many of them are on the younger side.”

Same as the following quotes:
“You know, it doesn’t really matter what [the media] write as long as you’ve got a young and beautiful piece of ass,”
""He was gropey ... he had his hands in the most inappropriate places, always,""

This been said. I honestly believe, same with other evidence, trafficking and more, that the 'Elite' are covering up their ass until it's time for blackmail. You either play by the rules or you're game over. Epstein broke the rule(s) and got kicked out of the game. Just look at the USA map with 'secret' underground tunnels and sanctuaries and link them to the missing children-alerts in the same freaking area.

It's very important to see the dots, connect them and you'll see a disturbing big picture.
Look at how players, play.. and you'll understand the game. Unfortunately, too many people are game-over without being able to recognise the game that has been played.",0,0
2051,59166699,6026897,"Is it possible to take someone offline using only Discord? 

Someone popped up to be pretending to be a girl and it was really weird... Then my internet goes offline for an hour, normally my internet is perfect. Seems too suspicious.

Should I report this person? Pretending to be a girl etc, but then I found a translated chat from a LoL server we are in, claiming he's a 24 year old dude with a 4 year old daughter? Why would you mention that, and be a creep to me? 

   

The person kept trying to ""turn me on"" I guess.",0,0
2052,59170292,6027261,Daily checkin boys & girls just got my coffee so it's a good day. Also excited for legday today.,0,0
2053,59167661,6026964,"Hello everyone, I'm newbie on hacking. Hopefully I can learn a lot of stuff from here without making mistakes ?

I wonder is there any girl in this forum? ??",0,0
2054,59167723,6026964,"At least two children per woman—that’s what’s needed to ensure a stable population from generation to generation. In the 1960s, the fertility rate was five live births per woman. By 2017 it had fallen to 2.43, close to that critical threshold.

Population growth is vital for the world economy. It means more workers to build homes and produce goods, more consumers to buy things and spark innovation, and more citizens to pay taxes and attract trade. While the world is expected to add more than 3 billion people by 2100, according to the United Nations, that’ll likely be the high point. Falling fertility rates and aging populations will mean serious challenges that will be felt more acutely in some places than others.

While the global average fertility rate was still above the rate of replacement—technically 2.1 children per woman—in 2017, about half of all countries had already fallen below it, up from 1 in 20 just half a century ago. For places such as the U.S. and parts of Western Europe, which historically are attractive to migrants, loosening immigration policies could make up for low birthrates. In other places, more drastic policy interventions may be called for. Most of the available options place a high burden on women, who’ll be relied upon not only to bear children but also to help fill widening gaps in the workforce.

Each of the following indicators tells a part of the global fertility story: not just how many babies women have on average, but also how well women are integrated into the workforce, what slice of the income pie they receive, and their level of educational attainment. Overall:


 Bloomberg - Are you a robot?  ",0,0
2055,59167540,6026848,"Tonight I'm seeing the girl I'm dating. Having some takeaway (which I'm getting free through cashback) then we're having a cheese and biscuits and port night (don't ask, she's a little posh).

Until then (Friday is my weekend as have no lectures today), I'm just making some money for my investment portfolios and savings. Over the weekend need to start essay plans me thinks.",0,0
2056,59161946,6026289,"   
prolly cause I'm not really confident in myself at all and I always wear hoodies outside and even inside, so I may come off as something's not right with me, mentally or whatever, I even got a random comment from a homeless crack lady once that I'm looking like something's not good with me, which is absolutely funny and worrying in the same time      

funny enough my friends are doing more drugs than me, and living in houses that LITERALLY look like crackhouses with homeless people in and Clay Davis, so I think they just don't like me for me and my personality or whatever, and I should move on and get new friends but the thing is that even though I have so many chances for hanging out with new friends, I'm somehow not interested in them, cause you never know what they like and Clay Davis and I'm too lazy to get on that same level of friendship 'cause it takes time to build that up, like I'm turned off to be social although I want to make new friends, if that makes sense lol",0,0
2057,59153325,6025638,   the way he posts he for sure actually a schizo. Also any time its diagnosed you can get disability meds or not. My girl is on disability and shes far from schizo. She has borderline personality disorder. Takes meds to manage it. But can still collect. Though I hate the fact she does collect and once shes gotta everything with therapy down pat she will be dropping her disability and going back to work.,0,0
2058,59146780,6024914,"   
Yeah so true, if you go down there was a woman who said they were too expensive about a year ago and they answered back writing in Swedish that she could eat on the closest supermarket if the food doesn't fit her and being very arrogant in the answer.",0,0
2059,59165321,6026752,"So don’t mind me y’all I just want to go on a quick rant about how ghetto it is to have a baby momma. I just left from my court date for child support & it is absolutely ridiculous how the courts favor women. First of all, I feel like child support is for those who don’t do anything for their children. Secondly, I have been an active parent since they day I found out she was pregnant. I’ve been there financially (Not working at the moment anymore but was for 3+ straight years) & physically for my son more than she has. So today at my court date, the judge was really talking down on me for being unemployed for about 2 months now. Yet, when it came to her being unemployed & not looking for a job for 3 years, suddenly that’s not a problem.

TL;DR: Wrap it up, don’t get these trifling women pregnant unless you married.",0,0
2060,59164089,6026617,"   
Sorry but when I'm either super passionate, happy, exalted, and well just a giddy 13 year old school girl about to go back stage by myself into the Beibster's Dressing Room type of happy I'll never be able to achieve the true essence of..  Oh where was I?  Oh I also get like that when I'm simply being well just me or trying to gain the trust of users in order to deceive them then I act just like that.  Meaning I just won't shut the fugg up and get annoying, lol.
 

That's for you to decide on.

   

It's all good Zed !




   


No Clay Davis?  Like what direct changes do you think I would be shocked or surprised to hear about?  Also am I really that bad in giving off signs that I'm an nearly 30 year old man whose longing to be the 12-16 year old ""hacker"" self again? lol",0,0
2061,59155297,6025773,"It's a nice country, interesting economics as the Nordic regions are considered to be ""socialist,"" but at the same time the markets are hyper-capitalist. Some beautiful women too. My only gripe could be a bit regarding politics, but we won't get into that :P",0,0
2062,59155276,6025773,"I'm from Canada and I imagine Sweden a bit like us, cold weather and friendly people.

I believe there's a lot of attractive blonde women there too     ",0,0
