Unnamed: 0,IdPost,Thread,Content Cleaned,Label,Sentiment
9471,17614852,1947638,"Personally, I don't think it's a very good persona, mostly because people ask where you're from, whether you're in school/college and things like that.

Here is one of my older persona's for example:

Spoiler  (Click to View)  Full Name: Kristy Crowther

Username(s): Kristylovezu, 19 f cam4paypal

Age: 19

Sex: female

Birthdate: 18/1/1994

Location: Canada, Nova Scotia, Digby

Post Code: B0V 1A0

Hobbies: Parties, photography.

Eye Colour: Green

Hair colour: Blonde

Race: White

Known Language(s): English

Studying: Photography

and have a different set of videos/pictures for each persona.",0,0
9472,50438383,5226755,"So I always get these guy that ask me to send a voice message to prove I'm real, and I have a (female) friend that's willing to make these. Would I be able to sell these sorts of verifications? Could be useful to some people.

Hope to hear from you guys!",0,0
9473,17614550,1947638,"You don't need hobbies really, Though if you want to think of some then go for it, The name is a girls name so that's a plus ha, The age is okay, I'd usually say 18 but its your choice.

And once again , With adding the rat, It's your choice.

Good luck on the E-Whoring journey.",0,0
9474,6905264,726360,"   

be nice girl :D
build server with out the all disable's and then only stealer and then turn it on and see if it send logs",0,0
9475,44255336,4627605,Actually thats a pretty good idea but it have to match to your girl :/,0,0
9476,44254822,4627605,"   

as many as you want haha. Depends on the girl though.",0,0
9477,41067637,4323214,"   

Thanks buddy! Hopefully you'll get your stuff sorted too.

Will i really have to call them? I don't have a girl voice lmfao.",0,0
9478,50422032,5225246,"   

Tell me about it, its one google search away. Reddit has a good community though. Each site has different types of men. The thing that divides the novices and the experts is knowing what sites have what type of men. 

The top things to aim for in an ""online arrangement"" (something that I've mainly only seen on reddit) is the ""girl friend"" experience. Guys that prefer the girlfriend experience really just want to talk, they don't expect nudes all the time and could care less about verification.",0,0
9479,12932589,1408625,"   

Its used as a ""middle man paypal"". You can send money on that paypal without verifying. This prevents you from having your paypal limited or charge backed. Also used to put a fake name(the girl you're posing as).
Pedo Cash -> Canadian Paypal->Your Paypal",0,0
9480,6728634,708158,So i got my 1st infection! he was just some perv kid chatting with girls off 321 teen chat haha. So i was fucking around with him and then i restarted his computer closing all the chats he was in. Then i lost him. How do i make it so i keep my infections when they turn off their computer?,0,0
9481,50302273,5210195,"Hello, I would like to get one of these packages. Time to change girl for ""work"" :) Thanks!",0,0
9482,50380019,5221443,"   

^ this, you can catfish a girl and trick her into sending nudes for free",0,0
9483,50380014,5221443,Twitter if you want the average college girl that really needs the money.,0,0
9484,50380010,5221443,"Chaturbate. Cam4. Craigslist. 

Or you can just get free pix from girls by using a really hot male ewhore to trade",0,0
9485,50379982,5221443,Where do I start? Where can I even find girls who would just willingly strip naked and send actual pictures and/or videos for cash?,0,0
9486,50411425,5221443,"I don't think anyone would really be willing, but if you go on kik and find the right girl she'll just send you tons of pics/videos xD",0,0
9487,50389737,5221936,"   
I wouldnt put that on a resume..

Although, I used to have a pack with a girl sucking a banana!",0,0
9488,50388475,5221936,"   

If you can make them really prefer your girl over all the other girls out there, then you have set yourself up with the ability to milk the perv ;)

EDIT
and I have never had an issue with verifying my whore because of the whole ""Sending the pic"" before they properly ask :P",0,0
9489,50387462,5221936,"   

Shit, in my pack the girl is sucking a banana, that would have been perfect.",0,0
9490,16050013,1766081,"x2BxPXHH94sladYLCVE17b

Keypass :  V3

It's incrypted in rc4 . . . 
thanks in advance",0,0
9491,50392295,5222538,"Hey,

I'm looking for a ewhore video of a girl moaning and stripping.

If anyone has one please pm me thanks",0,0
9492,50157854,5201463,"How's everyone been doing lately? I got a new pack for you guys ;)

100+ pics of the same girl

 Click here for a preview  

Have a good one    ",0,0
9493,50189960,5201463,"wow this girl is amazing, can i have the pack?",0,0
9494,50372855,5220801,"The most popular places to get along with ewhoring would most certainly stay with Instagram, KiK, Skype & SnapChat.

All you do is make female profiles at a wide variety of social media networks / discussion forums.

Try to act quick and churn accounts through so you can recover immediatly after your accounts drop down.",0,0
9495,41065898,4323101,"It is legal, even if she is under 18.
But, when she isn't well-clothed, she must be over 18.

If you share them (what you do at e-whoring) you must have permission of that girl and make sure you don't break any copyright.",0,0
9496,41065831,4323101,Its fine as long as the girl is over the age of 18,0,0
9497,41065746,4323101,"Well it depends if the girls pics are of an underage girl then yes, if she is of legal age then no",0,0
9498,50375929,5220772,just  photoshop his/her name on the girl thats what i did and got like 25$,0,0
9499,50366645,5220283,"A guy I whored gave me a traffic site with matured men not silly kids, the site itself has a lot of men than girls there     I have not tried it but I am going to start tomorrow I am taking break first. Online status shows 2000 online. Will I make money here?",0,0
9500,53278847,5477890,"   

thanks babygirl and its batty boy",0,0
9501,50341954,5218018,Dude your PM is full so can you give me one pack of hot girl with some nudes/non nudes?,0,0
9502,50340660,5217905,"h ttp s : // ww  w . youtube .c om / w at ch  ?v =K0A z8n tZbH k

where can i find a video of a girl like this taht i can use on omegle? 

thanks

also can also can someone post the acually link? thanks",0,0
9503,50340756,5217915,"So, I got $100 from a dude who wanted to buy some of my girls vids, and then I convinced him to send $500 for me to fly out to meet up with him.

The thing is, the $500 is in an AGC code, I haven't redeemed it yet, and I really want cash... What should I do?",0,0
9504,41028367,4319443,"Age 17? lol, looks like some one is doing something that I'm not allowed to mention on HF. ;)

OT: I really wonder what this guy is trying to do by ratting you. ^ What Unkn0wn said could be true. The pathetic bastard probably wants to look through your webcam when you give someone else a show so that he doesn't have to pay. I have to admit though, if he actually knew what he was doing with ratting you, it would be a pretty good idea. If you were a real girl of course",0,0
9505,50317337,5215660,i plan to do something similar but in a bigger way: find a hot real girl who would do live shows on skype and milk sugardaddies. i've been on some camgirls forums where they confess to making over $300-$500 daily. danmit!!,0,0
9506,50324784,5216472,"Most have this, I have a mega pack with a bunch of different women in, PM me if you want :D
Its not amazing but its decent for getting started ;)",0,0
9507,40976561,4314242,"   

look, basically, iv seen online vids of girls on omegle and all that, and they are stripping and all that, so i figured it must be guys pretending to be girls using vcw's and all that, so what im asking now is, anyone know how to get the girls on omegle? 

sorry if this is in the wrong section, or if no one uses vcw's for this kinda thing.",0,0
9508,40976500,4314242,"   

Are you implying you want to ewhore for pics of other girls? In which case thats pretty counter productive.

If you want pics of a girl just look up some on google - ewhoring for them is a complete and utter waste of time.

I apologize if I misinterpreted what you posted.",0,0
9509,40976494,4314242,"   

why the sarcasm?

all i was asking for, is where can i find girls to ewhore?",0,0
9510,50317436,5215728,"i have some which are actually real, pm me if you're willing to pay(different girls too)",0,0
9511,50283263,5212012,just ask some girl that smokes to take a pictures odf her while she does it,0,0
9512,50276579,5212012,"I need a small pack of pics of a girl smoking cigarettes. It can be 10-15 pics. I will be really, really grateful.",0,0
9513,50272622,5211587,"The pack I personally use have many non nudes and with the girl holding up paper that has no text on it, allowing me to photoshop in a specifics persons name for verification.

Then of course you'd need nudes quite a lot if you have a promising buyer. Goodluck",0,0
9514,35630237,3797351,I've told a girl i had a picture of her boyfriend kissing another girl ....,0,0
9515,17206490,1898696,"It is illegal. But so is j-walking. You will never get in trouble for the simple reason no idiot with his dick in his hand is going to ring the cops to tell them, ""hey i met this girl over the internet and never met her but i gave her some money... and she never stripped for me on her webcam.

And even if he did the cops would laugh at him and hang up the phone.

Go do what you wana do man, dont worry about proxies or VPNs or any of that bullshit. If anyone thinks the cops will get there tech guys on the case of tracking IPs to get some idiot perv his $20 back they have a screw loose. Now go E-whore!",0,0
9516,40976071,4314242,"   

Why on Earth do you want to find girls on Omegle?",0,0
9517,40975980,4314242,"   

have you ever found any girls in that section?

anyone also know what section should i type in omegle to find girls?",0,0
9518,41004703,4317355,Okay so lately ive been selling pics and do cam shows liuke i ask what they want and i have a pack with pics of a differant girl then i have cam shows unfortunately dont have the same girl for both... But when selling pics how do you guys choose which to give like i have 303 pics of a girl (most people wont buy 303) so how do u choose say which 30?,0,0
9519,41061865,4322439,chatavenue.com has the highest quality women for the highest quality men! Order yours today!,0,0
9520,41061894,4322439,"Instagram - Search #kikme (ignore all the cocks that pop up , look for finnish girls or what ever is to your liking's.)",0,0
9521,12628051,1375942,"I had to post this. Is this really E-whoring on YouTube or just some girl who want's to have fun?!
--
   ",0,0
9522,41060645,4322439,"I've seen real girls on kikfriends in addition to kikfriend, I've had decent success getting pics from there but the age is a little risky, FYI",0,0
9523,41059073,4322439,"Is there a site to find real girls on kik? 

I've tried mocospace and have gotten lucky but not so much, only 2 sets so far.

I'm willing to give a user a set that i got from a girl (i made her do what i asked) 

I'm talking about lesbian girls ;) 

currently trying kikfriend but is there any other ones?",0,0
9524,50212323,5205221,"Do I enjoy E-Whoring? No.
Do I enjoy the money made from E-Whoring? YES    

I don't think that any guy really enjoys talking to a bunch of horny guys, looking at dick pics, while acting like a girl/lady/whore.    ",0,0
9525,41060767,4322599,"Hi - I'm getting set up to sell pics via Craigslist ... here's what I have:
1) email
2) fake name etc
3) vpn (somewhere here in the US)
4) two paypal accounts
5) hundreds of pics (some clothed some not - will break them into sets)
6) sob story - need a tire so I can get my car inspected

What I need is the beginnings of a Craigslist advert - I know it should be under 'women seeking men.'

I'm thinking of a title 'looking for a friend and possibly more' or something similar.

Also I'd like a generic response to send them from my ewhore email address when they mail me.",0,0
9526,50211713,5206023,"Hey


So this guy told me he""ll send me 250$ if I could do a lesbian video with my friend, "" a girl from another pack I have"", I agreed, he alrdy bought from me, Idk what to do he alrdy sent it lol",0,0
9527,50188128,5203926,"reminds me of ""youtubable"" from youtube when he used to do his girl voice on cod & omegle haha good job man :D",0,0
9528,50188056,5203926,"I am able to talk in a way that makes me sound like a female. I even catfished a radio station host in Michigan, I was talking for 5 minutes with him and then started talking in my normal voice.
Maybe I can implement this into e-whoring? I can make calls using Google Voice to pull this off.


   

It'd be a tad bit more convincing if I didn't talk in my normal voice as well


I would have no problem phone sexing some guy while playing CSGO or something.

nohomo",0,0
9529,48804936,5078749,"   

Tubecamgirls DOESN'T allow chat traffic but on my network, i will allow it. And also there's nothing special about my network, I'm just sharing what makes easy money to others that are struggling making money through eWhoring (by selling pics & vids).",0,0
9530,50218007,5206613,"hey guys, i have a girl who will do just about anything for me, as you can guess this is a valuable commodity in this game, i would be willing to get her to take pics for some of you guys, message me for more details 

preview of her
 Preview 1   /  Preview 2  ",0,0
9531,50201204,5205134,"Hey guys :)
Just started e-whoring yesterday and already had a little succeed.
That guy is willing to pay more if I send pussy pics or videos.
Anyone has videos (low quality would be better I guess) or pussy pics (prefering no face) of a girl that looks like this one?
pastebin.com/U6uvVA79
(cant post links because I havent got 50 posts yet)

Thanks in advance :)",0,0
9532,51549871,5327917,"I am one of those college kids! But we had a great time. Was wit my girl and a few friends and it was lit. :) 
Gotta love NY",0,0
9533,17575198,1933241,"tell her you have an online alter ego that is a cute 19 year old female that exposes herself to creepy old men over chat sites, craigslist etc. for college money.",0,0
9534,44351732,4637741,"   

Prayers to all the little girls out there that were ratted",0,0
9535,44325839,4635512,Is she hot? inb4 she is some crusty ass old lady who wears skirts and cardigans regardless of the weather.,0,0
9536,50186147,5203748,"Anyone know of any decent websites where you can dl vids of girls fingering themselves? or know any good videos specifically of girls without a face. I'd really appreciate it, thanks in advance.",0,0
9537,49874141,5175373,"^^ yeah I just found out that hard way u can't link here, makes sense and most pics are nude girls ect

I'm reading some of these messages from these guys! Ripe for the pickings
   ",0,0
9538,50185087,5175373,"Higher Numbers does not equal Quality

These guys are on there to meet girls because they are lonely. The last thing they will want is to buy nudes of a girl when they want to instead meet them. Trust me, as soon as you mention selling pics they will know you are fake, report you, and ignore you.",0,0
9539,50162282,5201816,You would need a real lesbian first and that's hard to find. I guess it's possible to get a woman to pay but getting a gay man to pay is probably easier.,0,0
9540,50162164,5201816,"I thought about it, but I don't think girls would pay for that",0,0
9541,50161951,5201816,"It's a nice idea, but I guess it's pretty hard to make a girl pay for that.",0,0
9542,50161901,5201816,"Topic kind of says it all.

Have you ever tried ewhoring lesbians and how well did you do?
Did you notice some major differences between ewhoring men and women.

Can't wait to read your stories.",0,0
9543,50161804,5201808,"Hi everyone

My ewhore clients are requesting to hear my voice on phone and on skype

I need your advice on male voice changing to female voice on phone and on skype

Please lave a comment. Thanks for reading!",0,0
9544,50167633,5202324,Lmao yea except most of them that claim they are drug dealers most likely are not. Just acting like it to impress a girl or some shit if they think like that.,0,0
9545,50089806,5195123,"The question is, why is e-whoring working so well? Everybody knows there are millions of pictures and videos of naked girls in the internet. So why are these guys willing to buy those from you? Its not only because they believe you are real.. they believe that they get real, private pictures from a amateur girl and thats make them horny and weak. Its all about their fantasy. 

I guess you just got unlucky. The art of e-whoring will change. But there will always be horny guys who wants their ""private special pics/videos"".",0,0
9546,50089000,5195123,"in fact the more technology advances, the easier it will be to appear as a believable woman online. Using apps like fake cam etc will seem extremely primitive in the future as a form of faking identity.",0,0
9547,50058931,5192438,"Hey guys. Been a while since I E-whored and want to get back into it. 

I've lost all of my files due to a new mac. I had a vide of a girl that was in a pink room, with a list of clips where she Waves, blows kiss etc .. Anyone know where I can obtain it?

Thanks       ",0,0
9548,41058596,4322345,"I see. So the best option would be to use a VPN with a static IP for the girl PP, so the two PPs IP's are different.",0,0
9549,50072733,5193240,"heyy i was wondering if you would like to help out a broke college girl looking to pay her rent ;) ? x

just kidding with the ewhore mode, congrats on uber bro. :)",0,0
9550,50071611,5193240,"Men, when asked to write how much money they think they'll make in 5 years, they put higher numbers when females are in the same room.",0,0
9551,50077176,5193240,Female rights biggest joke ever,0,0
9552,50074828,5193846,"   

This wouldn't help OP at all stop trying to steal his client


OP just google ""girl wearing diaper"" and crop out face, make sure it looks like from a iphone not no stock image shit",0,0
9553,50080755,5194387,"Okay my plan might sound a bit weird but here goes.

I'm going to chat and sell pictures AND sell custom adult art. Or maybe just sell the art and show some pictures.

Is that combination too crazy? As far as I know drawing and selling such drawings doesn't count as ewhoring,
 but if it was a hot girl selling hot art wouldn't that make the art more valuable to guys? 

Should I try some forums or should I do the chatting and art separately? Or should I make a website?

I'd love to hear your suggestions.",0,0
9554,50051720,5191728,"If they're willing to throw away their rent money, on a fantasy girl they've never met, let them. If you don't get the money, someone else will.",0,0
9555,50064948,5192941,"Using private pics is not really cool.

I mean ripping them from sites where the girls published them themselves isn't the most moral thing to do... but this is a whole another level. 

Also, if you ratted them, how do you know they are 18+?

Haven't really thought this through, I'd say.",0,0
9556,50048649,5191481,I learned a lot from the ebook Oddissee wrote. The key is to convince them you are a young helpless girl needing money and make dudes pay to take advantage of that. You can have unlimited approaches as long as you keep it a little creative and use method that is best for you.,0,0
9557,50048595,5191481,Use social engineering to your advantage. Become the girl you're using.,0,0
9558,49998766,5187001,"   
If anything you guys are trolling and pretending to be girls and actually like seeing guys dicks.",0,0
9559,50001628,5187282,"   

You just send the money from the female to your account? Is that what you're saying?",0,0
9560,50001601,5187282,I used to use my main but would have to give a shitty excuse but I just made an email for my girl and now it goes by easier that I have a paypal with a female email,0,0
9561,47771326,4980041,"Change all profile stuff to girl gamer, wait for some horny guys who want talk to you, enjoy free skins with some SE  EPIcccccc",0,0
9562,47769941,4980041,"   

Change all profile stuff to girl gamer, wait for some horny guys who want talk to you, enjoy free skins with some SE",0,0
9563,49957313,5181479,"Another method is to Social Engineer a Cam girl into giving you her pics and videos for free, or paying someone to do pics for you",0,0
9564,49953363,5181479,"Imagefap.com

^ Go there.

Then go to the search bar and type ""Selfshot""

if you want specific girls and better packs do like ""Latina Selfshots""

and etc.

GL mate.",0,0
9565,49951882,5182548,Jeez... 90% of guys (Pervs That Would Buy) arent going to believe a real girl would even Take 50Nudes In one sitting... Never mind for 15GBP #WTF,0,0
9566,49950569,5182500,"   

Then that's your answer. How do you think your parents will react when you tell them you are posing as a girl sending fake nudes to perverts that send you dick pics in return and receiving money from them?",0,0
9567,49951694,5182500,what the fuck is the point of this thread LMFAO why would you openly discuss posing as a woman and committing fraud over the internet with your mother,0,0
9568,49951676,5182500,"I think that depends on your parents, I mean ,some parents could think that this is blackhat or something illegal and really dangerous. But someone can give a fuck.
One my friend told to his dad that he`s ewhoring, and his dad told to all his friends that he find online a beautiful girl that sell pics and vids, just to make some awesome traffic for his son.
Real love for sons. :D",0,0
9569,43912637,4594543,Tbh nobody really give two fucks about having girls as slaves unless they are pervert or people that can't get girls in real life. $0. It like saying how much is a eBook that makes you talk to a girl or how to get a girl to like you easily.,0,0
9570,43912623,4594543,"My ebook is now finished and can be found at my other thread along with vouches!
   
Any questions feel free to message me on skype due to not having enough hqp yet - notnimdab1
Your opinions are welcome and appreciated! Thanks :)

Incase you are interested wether i do actually get girl slaves, check out for yourself :) gyazo.com/e1a081450a4cc4e7d71cf14ea7c52f9e",0,0
9571,43915424,4594543,I honestly would think its funny just to see their reaction once you fuck with their screen or some shit. Most girls I know freak out if 1 tiny thing goes wrong LOL,0,0
9572,43912665,4594543,vouch for nim he can get crazy amounts of girls with cams,0,0
9573,44058282,4594543,you're a fucking creep why would anyone care whether its a girl or boy for there slaves,0,0
9574,49906007,5177944,I send them a picture of tub girl and tell them to kill themselves.,0,0
9575,49837425,5172199,"So every time I make a new pack, I make a new opener and usually change the prices around as well. What do you guys usually sell your packs for? I normally do $25-$30. Also how do you present your girl to them? I usually do it in one big message describing everything to them, but some people have other tactics.  I've also been interested in an auto responder, so if anyone has tried that method I would love to hear about their success with it. Let me know your guys thoughts and as always have a good day.    ",0,0
9576,44027133,4604111,"I have an eBook about how to rather successfully rat girl slaves, check my thread for more info    ",0,0
9577,49905173,5178328,"Look up, 3 girls sex on google images, you're welcome.",0,0
9578,49904758,5178328,"Hi, there is a dude that is willing to pay 300$ for a picture with 3 different people together and I don't know what to do since the 3 people that he wants pictures of are 3 completely different women and i need help ASAP. Please PM me if you want to help me. I said that they are going to eat dinner so they'll be back in 30-35 min",0,0
9579,49875190,5175460,If you are a girl then we can make a deal,0,0
9580,49862505,5174073,why everyone spread this girl on this forum :DD  wtf ??  I've seen her thread 5 times already.,0,0
9581,49842694,5172707,"All 36 pics of this girl are mirror selfies.
Hope you enjoy it as it's free Smile!

Download Link:
Send me a PM for download link

Preview:
   


Drop a voucher please after you receive the pack.
   ",0,0
9582,3871432,404236,"   
Dude are you a girl or a guy?",0,0
9583,49748866,5163848,Be sure to have a verified girls section so that people will be more attracted to buy.,0,0
9584,49746657,5163848,"Make a male and female section, don't put popup ads because that's just annoying and drives users away. Don't ban anyone from the site because you will lose a lot of people that ewhore that way. Don't let the users upload their own images, just make something to grab their kik photo. I think the site should be not like a profile website, but you get to sign up and then there's a main page where you post a message for example 'hey, my name is ___ and I like to swim and play volleyball hmu'.Also remember to add captcha if you don't want bots flooding the site.",0,0
9585,49749161,5163848,"   
Lmao every vertified girl selling pics and vids",0,0
9586,49749076,5163848,make a verfied girls section and put all the HF e-whores in there so we can make some $$ xd,0,0
9587,2738149,279191,"Weed sucks makes you less badass, and your girl is doing tha duck face bullshit.  meh  No pot head is badass in anyway, and the Dethklok rip off of a name lowers you down in the badass ranks,  0/10.  Now if you spoke a dead language like  I do, or just had a different personality than you do i'd give you at least a 3/10.",0,0
9588,49720200,5161294,"   


The traffic part of it would be hard to automate, as he would always need new traffic sources because sites would quickly catch wind of this particular girl always posting.",0,0
