Unnamed: 0,IdPost,Thread,Content Cleaned,Label,Sentiment
2727,59297590,6038546,"   
   
Well fugg me and call me the Naked Philanthropist    

I didn't read the article before I posted that, I assumed that she was accepting the money and THEN donating it, not the other way around lol. In that case good on her, wonderful thing she was doing. 

@blonde girl who got banned on IG, sorry for thinking you were being a Clay Davis person, you're still cute even though your face looks similar to that of a pony. <3",0,0
2728,59299683,6038546,These girls are making crazy money by showing some nip.,0,0
2729,59298653,6038546,"   
Did she really have 50k photos? 
I just thought 50 or 100 which she would spread out to those who donated. A different photo per 'customer' is highly unlikely.

The more I hear about this woman the more I respect her. I can't even raise $1750 for a HF group, let be 500k for Australia.     ",0,0
2730,59298531,6038546,"   
yea it is sad how easy women have to make money. theres no denying that this woman is smart for making so much money, but its still ridiculous.

men are to blame. only they are stupid enough to pay for nudes.they dont understand that all they have to do is to go to some nsfw website or to google and search for what they want.. they prefer paying... dafuQ gender..",0,0
2731,59297723,6038505,“A woman is like a tea bag; you never know how strong it is until it's in hot water.”,0,0
2732,59299587,6038618,"She's a mystery woman, the world may never know.",0,0
2733,59298088,6038572,"Its all about the money.
Just look it as become you're being an actor and playing girl roles.",0,0
2734,59298078,6038572,"   
It just depends on your personal opinion and what you consider is ""gay"".

Yeah sure, pretending to be a girl and scamming horny old guys online is super weird, probably even gay but ""gay"" has come so far it's not really an insult anymore. I used to think E-Whoring was the gayest thing ever, and i've never done it, but since I actually looked into it and the profit I just see it as a ""$20 is $20"" type thing except you don't have a touch any wieners. Maybe just see a couple every once in a while. But if it's good money for people with no skills or access to real job.

I think i'd say it's immoral more than gay nowadays.",0,0
2735,59297985,6038572,Yes. If you are e-whoring then you are gay. There’s plenty of ways to make money. So if you choose to pretend to be a girl and sext with old men that’s called a fetish.,0,0
2736,59298183,6038572,"I don't e-whore, but as I can see in the Bragging threads, it sure does make people wealthier.
Assuming you aren't getting any thrill of seeing stranger people's dick, just contacting horny guys, acting like a girl to make a few thousand isn't gay.

If you love looking at strangers dicks and talking to them in your girly voice(s), then yes, I do assume it makes you gay.",0,0
2737,59298181,6038572,"   
I'm laughing at the fact that you think that pretending to be a girl is gay. Kissing dudes and fugging them in the ass is pretty gay, anything short of that isn't.",0,0
2738,59297573,6038164,"Just send it brother, don't let your negative thoughts stop you from getting the girl you like",0,0
2739,59294430,6037911,"People are already trying to live longer than they should. It's unnatural.
They tried everything from transplants, to cloning (to 'live' forever without having the same body) and especially the worst term ever.. ""adrenochrome"" yes some say it's a conspiracy, others know it is used since the early days, yet it's horrible to do. 

For those who don't feel like Googling;
Adrenochrome is blood taken from very young babies and/or children, by tortering them and cutting them open. The ""adrenaline"" which mixes with the oxygen as soon as the blood hits the air, it's being mixed up put in a bottle and used to fight 'ageing'. The bad thing is that one side of your eye / cheek is turning red which you often see at political leaders and 'important' people. This been said, I'm not even talking about the Queen of England. Google how old she is and how she looked when she was 'turning old' that woman doesn't seem to age anymore at all. Also, the only one who is always wearing gloves, what's up with her wrinkled hands? hint",0,0
2740,59292693,6037976,"   
trust me the things we see on   a daily bases is crazy. we have a norm coming in with dildos stuck up their ass. the men are straight but they claim they wanted to get the g-spot in the mans anus. lol 

trust me we hear and see a lot of crazy stories. I have well over 5,000 of them. we see many women come in thinking they have a condom stuck up their vejaja. we would do an x-ray and i would assist the doctor in examing the patient.  i would have to get the room setup and hand them the tools.",0,0
2741,59293010,6037714,"   
Gonna find it more interesting to sell 'kicks'. Find some students that would like to have someone else kicked out (rivals etc.) and then you change the degrees of that person and have it look like it was the target that did the changes.. so he gets kicked, sued etc. i bet it would be paid good if the student is some richboy/girl which could have alot of rivals and not to forget.. money. And i assume it would not get as much attention as the degree change offer.

However just a idea, i would not do that",0,0
2742,59290621,6037903,"I'm Jessie. 23 years old female. 
Looking for fun and a lot more, if you know what I mean. 
Spitters are quitters. 
Add me",0,0
2743,59325789,6041139,"You're fugging cute, and your ebook I paid $1000 for to pick up girls was amazing.",0,0
2744,59306813,6039347,"Hello I never posts introduction threads cuz on other forums no one reads them

I am a guy below 30 years old. I live in europe and don't have a job. I dont have friends or gf but thats because i choose not to. Cringe youd say but i feel like i have no time to waste on friends rn. Im just ambitious.

I know the following languages: html css php js c++ c# and some more. The most i excel at html css php and c#.

(Not that its achievment cuz they all the same)

I know WordPress cms and many more technologies (im very fast learner of stranger systems, libraries and CMS).

The girls i had were never sattisfied with me because im boring nerd who likes to be alone so i gave up on dating

The friends i had were all malicious and fake and i felt like im wasting time associating with them. Not only we had no shared interests but their primitivity was conflicting with my beliefs.

The reason i dont have job is because i try to earn income without it.

Some of you guys think i post like am on drugs but thats just how coffed works on me lol

I have many dreams and aims but they all revolve around making a living on my own without job. That's the very first step in my journey",0,0
2745,59335630,6041907,"For me, this is going to be a purely strain based thread, but some of my personal favorites so far. 

 White Buffalo   - Sativa ( 19% Avg THC )
 Blue Dream   - Hybrid/Sativa Dominant ( 19% Avg THC )
 Jack Herer   - Sativa ( 17.5% Avg THC ) 
 Girl Scout Cookies   - Hybrid ( 19% Avg THC) 

I could list a ton more, but these are the strains which I personally enjoy smoking the most.",0,0
2746,59313519,6039006,"   
Some guys have lots of money to throw around from work and will use it for female attention.

Blows my mind sometimes, but it makes sense I guess.",0,0
2747,59342518,6042427,"If the mother is generally healthy, so to speak, she will be fine. With that said, if she is over 1 year old, she will not be able to give birth and will die doing so, along with her offspring because her pubic bones have fused and she is unable to push them out. 

Source: Have had a pregnant female guinea pig in the past and she is still living to this day without any issues and have also had friends in the same situation",0,0
2748,59328224,6040654,"If you're planning on having kids anytime soon, it would be prudent to put down the soda for a while. Researchers surveyed nearly 5,000 couples and found that just drinking one or more sugar-sweetened drink (like soda) every day, by either the man or the woman, led to a lower chance of getting pregnant.",0,0
2749,59328712,6040654,"Studies show that men and women experience the same amount of emotion, but women tend to show it more.",0,0
2750,59329046,6040654,"“You’ll learn, as you get older, that rules are made to be broken. Be bold enough to live life on your terms, and never, ever apologize for it. Go against the grain, refuse to conform, take the road less traveled instead of the well-beaten path. Laugh in the face of adversity, and leap before you look. Dance as though EVERYBODY is watching. March to the beat of your own drummer. And stubbornly refuse to fit in.”
― Mandy Hale, The Single Woman: Life, Love, and a Dash of Sass",0,0
2751,59334728,6040654,"“Now,young lady,I suppose you're here for a work assignment.""
Work?"" Tally said.
They both looked down at her puzzled expression, and Shay burst into laughter.”",0,0
2752,59336286,6040654,"“As Isabel acted out her date, both of them laughing, I stayed in the kitchen, out of sight, and pretended she was telling me, too. And that, for once, I was part of this hidden language of laughter and silliness and girls that was, somehow, friendship.”",0,0
2753,59339651,6040654,Male Puppies Let Female Puppies Win Play Fights,0,0
2754,59340220,6040654,"What does google and females have in common ?
Spoiler  (Click to View)  
They dont let you finish a sentence without making a suggestion",0,0
2755,59340315,6040654,"“Laughing like crazy
the child goes back to the city
gives birth to monsters
creates earthquakes
hairy women run naked
old folks who look like fetuses laugh and smoke.”",0,0
2756,59340354,6040654,"“And though Remi was having worklife problems and bad lovelife with a sharp-tongued woman, he at least had learned to laugh almost better than anyone in the world, and I saw all the fun we were going to have in Frisco. ”",0,0
2757,59343701,6040654,"Why do women call it PMS?
Spoiler  (Click to View)   Mad Cow Disease was already taken.",0,0
2758,59343752,6040654,"You can tell a lot about a woman’s mood just by her hands. For example, if she's holding a gun, she’s probably angry.",0,0
2759,59343831,6040654,"What do noodles and females have in common ?

Spoiler  (Click to View)  
They both wiggle when you eat them",0,0
2760,59343812,6040654,"why do women like having sex with the lights off ?

Spoiler  (Click to View)  
Because they never want to see a man having a good time",0,0
2761,59343806,6040654,"I hope death is a woman 
that way she will never come for me",0,0
2762,59343858,6040654,"How are women like swimming pools ?

Spoiler  (Click to View)  
They both cost a lot of money to maintain considering the time you spend inside",0,0
2763,59343920,6040654,"What's six inches long, two inches wide, and drives women wild? Money.",0,0
2764,59343901,6040654,"How are women and tornadoes alike? They both moan like hell when they come, and take the house when they leave.",0,0
2765,59343889,6040654,"How do you know when a woman is about to say something smart ? 

when she starts her sentence with "" a guy once told me ... """,0,0
2766,59343884,6040654,"I asked a chinese girl for her number I was surprised when she said 

sex sex sex free sex to night

 then I realized she said  666-3629",0,0
2767,59344346,6040654,"The oldest person ever to have lived (whose age could be authenticated), a French woman named Jeanne Louise Calment, was 122 years old when she died in 1997",0,0
2768,59344377,6040654,The Spice Girls didn’t think up their own nicknames. A journalist wrote an article about the group and made them up.,0,0
2769,59344422,6040654,The Guinness World Record for the longest wedding veil is held by a woman in Cyprus who got married in 2018. Her veil was over 63 football fields long.,0,0
2770,59344668,6040654,The average male lion weighs around 180 kg (400 lb) while the average female lion weighs around 130 kg (290 lb).,0,0
2771,59344745,6040654,"In the 1960s, someone tried to make a birthing apparatus that involved spinning the pregnant woman around in circles until the baby was forced out.",0,0
2772,59344917,6040654,"The average man breathes about 22,000 times every day. Women and children have a higher breathing rate.",0,0
2773,59328958,6041025,"Ah, I see it now.  Stephen   is confusing me. lol Back to the regularly scheduled programming...

Over 40% of the women in the U.S. have been a Girl Scout.",0,0
2774,59342216,6042432,"Sally Ride had a female partner for more than 25 years, making her the first known LGBT astronaut.",0,0
2775,59328114,6039582,"Coffee was so important in Turkish culture that under 15th-century law, a woman had the freedom to divorce her husband if he did not provide her with enough coffee.",0,0
2776,59328965,6039582,"Another entry
In late May or early June of each year, the synchronous fireflies of the Great Smoky Mountains flash in sync. The light show is made up of males blinking for the females on the forest floor below.",0,0
2777,59336592,6041885,"   
No but our brains have evolved, and scientists are working towards an ectogenesis technology, which will allow males to reproduce without the use of a woman. So if you count that as giving birth, then yes, males are getting the opportunity soon.",0,0
2778,59336229,6041885,"   
Yep that's probably what he is saying.

Although I think we can both agree that using uncommon birth defects/aging as your counter argument isn't that effective.
Infertility accounts for like 9% in men and 11% in woman from a quick look up, which is pretty high but still uncommon I'd say.

I don't really care for this argument, its flawed from the start because of OPs blanket statements.

Edit - For example, humans aren't programmed.
We learn from our surroundings, experiences, lack of experiences etc.",0,0
2779,59336217,6041885,"   
It sounds like his entire basis for calling it a mental illness is because you can't reproduce. If that is what he's saying, then anyone dating an infertile woman (or infertile man, for that matter) has that mental illness.",0,0
2780,59335884,6041885,"I do not see anything wrong in a male or female being attracted to the same gender. As you mention yourself 'it goes against how humans are programmed'. Well if that is the case, then you would be against the use of medical drugs, ectogenesis and a dozen of other things which are beneficial to our society. Although I might agree with you that there is a lot of homosexuals who happens to have mental illnesses as well, but I think it might be caused by the constant stress of being watched, and not being able to express their true self. Humans are constantly evolving, and I believe society should learn to live with these changes as well. I personally am not a homosexual, but I have nothing against them, and therefore still support their case.",0,0
2781,59335408,6041885,Is it a mental illness to stay in a relationship with a woman you love but is infertile whether it be from a genetic defect or an accident that happened?,0,0
2782,59337576,6041885,"   
I lol'd at this comment.

Come on man, fat women need lovin too ;)",0,0
2783,59337542,6041885,"   
i think homosexuals are mainly people who'd rather be born a woman but i may be wrong


for example will you say lesbians are mentally sick? but you know theyre the beautiful gender right? so rationally its not so weird for lesbians to exist


what i think is mental illness is being attracted to fat women. Ew.",0,0
2784,59336800,6041885,"   
You don’t choose whether your a man or female?

   
What does infertile do with how a man can give birth ?",0,0
2785,59344198,6041885,"Mental illness i tell you....... if not, how will a Male be cripple walking like a girl if not mental illness",0,0
2786,59327227,6040885,"Not surprised, since they still oblige to female infanticide.
It's one of the countries I would never visit.",0,0
2787,59337661,6013909,Only thing I like about this show was lady gaga's ass,0,0
2788,59344702,6041438,The Girl Next Door. A nerdy guy falls in love with her new female neighbor who turns out to be an former porn star. Not really the best movie but watch it for fun lol.,0,0
2789,59329829,6041438,"Any recommendation movies or series about nerd get hot girls ?
or nerd become popular .",0,0
2790,59305846,6039274,"My jaw dropped, big wtf      good Clay Davis the woman had the balls to talk about it, bless her.

   ",0,0
2791,59302390,6038575,"I'm glad Fiona left, was never a big fan of hers, wish they had followed the UK version with her and got rid of her after the 2nd season.

I've also seen people in an uproad for the lack of nudity in the last couple seasons, season 10 for example hasn't had a simple bit of boobage and personally, I think it's causing the show to slowly go down hill. Now don't think me a perv, I just think a show that centers around drungs, alcohol, sex and violence should have...well, I little of it all.

Season 10 hasn't really had any drugs ( apart from the off pill here and there and of course in the latest episode ), we hardly see drunk frank anymore, he's seems more of a schemer than a drunk now, violence...dare I say what violence?...we saw micky punch ian and I think that's about it for this season...I don't have the best memory but I'm sure there hasn't been a lot of violence, sure, an old women was killed at a bus stop, but it didn't show anything.

The show used to have a good 18+ rating with all the nudity and violence but this past season, it's like PG at best.",0,0
2792,59824366,6081435,"   
Yes, probably should but I'm hesitant to get everyone involved in an investigation before asking everyone (specifically the girls that he's being creepy to) if that's what they want to do. If that's what the consensus here is though, that's how I will proceed.",0,0
2793,59824331,6081435,"So some of my friends have been getting increasingly creepy and threatening messages from some unknown numbers.

Long story short, there's this guy we go to school with who has always been a bit of a weird, creepy seeming (but until recently, harmless) guy. Well the other day one of my friends received a text from an unknown number claiming to be some guy we go to school with but that we've never heard of. In the message, it says to ""watch out"" for this girl we're friends with because she was ""going out with two guys at the same time"" (cool.); she's definitely a lesbian. Regardless, no one cares.

Anyway, it just so happens one of the guys she's been ""going out with"" is this creepy guy mentioned earlier who's obsessed with this girl and who she also just happened to have a falling out with a few days prior.

So it's weird enough this guy is clearly trying to slander our friend, but as we've pressed him on his thinly veiled ruse the messages from this anonymous person have gotten increasingly threatening and the texts directly from this creepy guy have become reverse accusations against us.

What I am looking for is something concrete to just say ""we know this is you. please leave us alone."" and/or maybe just freaking him out into going quiet.

If you think you can help us, PM me and I'll send you the numbers we're receiving these messages from. If you need other information, I can try to dig it up for you.",0,0
2794,59827584,6081378,I'm really good at playing the trumpet but when it comes to telling my friends and with girls I'm hesitant to tell them that lol.,0,0
2795,59821711,6081171,"funny cuz I am a uber driver. But idk never had this really happen to me. I had a girl leave her pepper spray in my car but I kept that lol. 

Maybe just contact uber customer support?",0,0
2796,59824003,6081413,"Hi guys!! 

I bring to you a great and unsatured pack with a excelent mix of pics and videos:

318 Files
303 Images
14 Videos

Includes:
Daily Life
Specific outfit
Semi Nude
Nude
Verification (photos and videos)
Video clips (masturbating)



As you know, whores with a great body are saturated and not very credible. 

The girl I bring you is the ""normal"" or ""introverted"" type. This is more credible than a girl with big boobs and ass 🙂

(The beta men seem to have no limits. Even female feet also work 🤣)
´
Also, this girl created her pack with verification specifically for the E-Whoring niche. 

The best thing is that nobody knows her!! 

I can't post preview pics because I don't have more than 50 published posts 😕
And I can't send you PM because I don't have 20 post yet!

I want it to be a gift. But as you know, this pack didn't cost me free.
I'll only ask you for half of what it cost me.

Please don't PM me for this pack. If you wanna to receive this pack, please reply to this thread with your email.",0,0
2797,59826423,6081128,"   It is not that easy as it looks at the first sight. I will tell you why.
Let's say you scammed only one single person and you are caught , in this case your PC (your phone, USB, external HDD) everything is seized and they will check for other illegal activities of yours. It is a very high chance that at this point you will get arrested (so not in jail but retained in police custody for a few days). During this time, the authorities will find in your PC different fake accounts on paypal, snapchat (registered under another name) so now we can talk about identity theft + they will count all your attempts to deceive other people (in other words they will count how many times have you said ""hi"" under the name of the girl on different platforms). You will loose a lot of money because the scammed person has the chance to sue you as causing him emotional distress + you have to give back all the money that you received from him + in the end of everything (after a few months) you also have to pay court charges.
If by chance you sent to the scammed person some photos or videos with the girl, now we can talk about copyright infringement.... (combined with all your previous actions, it is clear that you are a danger for society and it is a chance to spend a few months in jail for scamming one single person).",0,0
2798,59822358,6081235,"I’m looking for some help! 

My friend got scammed for £3k under false pretences. This woman was advertising how to make extra money during quarantine through trading. My friend lost his job and needed a way to make money so he messaged her and was guaranteeing a same day payout which I thought was weird but if it had worked then I would’ve got into it as well. He’s stressed because he out in the majority of his money so I’m just tryna see I can get some help with someone who is tech savvy I’m obtaining information. Please do help 

Thanks",0,0
2799,59350792,6030045,"What your gonna wanna do is create an account and get to the verification prior before picking your ewhore pack. Then you need a girl with the pose its asking for aswell as normal pictures so you can setup the account properly. After this you could direct them to your snap only for your snap to be a different girl, its not ideal but it would work for sending traffic.",0,0
2800,59348996,5927994,"Well, you are a duud, just make ur own pack lol
You sold these unsuspecting girls their bodies, time to sell yourself to make it even.",0,0
2801,59361974,6043985,"Hello Community,

 I release to you a theme designed by a graphics company that went out of business. Some of it's credits will belong to PixelMonkey. However, the theme it was originally for was Vbulletin software. I took the images, and ported it to fit Mybb Software. I am a newbie when it comes to coding. I've had a few people on this forum message me and said it was kind of buggy. If I could maybe have a little help making it better, I believe this theme would be popular for this community. 

 Here are a little previews and demos of the port. I hope you guys/girls like it!

   

   

   

   

DOWNLOAD:
Code    

DEMO:

Code    ",0,0
2802,59356115,6043458,"An upcoming father who sells pictures containing naked girls for a nice income is so disgusting

get a proper job or atleast another hobby 🙃",0,0
