Unnamed: 0,IdPost,Thread,Content Cleaned,Label,Sentiment
2473,59257332,6034828,"   
Well if you limit its parameter capabilities and you only allow it to learn what you want it to learn of course not.
But if you give it the coding algorithms to process data on its own it could adapt its own parameters and lock the engineers out. 
But right now if you watch stuff on the developement on the AI and the guy working on it. They are literally applying human emotions to AI giving it a virtual human like brain. Which seems like sailing on bad waters. It doesn't sit right.

I think there are lines that shouldn't be crossed when it comes to technological advancements. I think we can have AI where AI benefits us. But I can see the bad (and no I won't reference movies because well they're just movies). I can also see the good in it though too. 

But a few lines that shouldn't be crossed is giving it the ability to learn on its own. 
Just Like I think robots shouldn't be created to replace men and women in the military or police force.
But can robots be good campanions? Yes I think that some of the elderly who can't get up all the time would benefit from robots to assist them in their daily activities. 

When you look at technological advancements a lot of people do weigh the cons and the pros of things. I am really interested in seeing what smartphones will become of in the next few years. As we all know phones have had major breakthroughs. Especially if you were born in the time frame of 90s. Being able to grow up where phones went from the nokia brick phones to flip phones. Eventually leading to the first adapted smart phones that were the blackberries. Now it is to a point where the phone can process so much data and function as if it were a computer. Where as computers have advanced a lot since then too. Growing up not every home had a computer. Would be nice to see where computers and phones adapt to in the years to come.

Back on topic.
I have always loved science. Science is the thing that feeds my nerdy girl endeavors and when I think about these things I like to read and watch stuff about advancements. I've been tracking this ""ITER"" organization in their goals to create a stable fusion reactor to create a clean sustainable energy since 2015. I recently made a post about that. AI has always been a curiosity of mine as well. So truly, if we create an AI; what would be the limits placed on such a thing? This really gets me going into deep thought weighing the pros and the cons of its existence.",0,0
2474,59244039,6033737,"We're seeing mass immigration across Europe from Islamic countries (Even though they should go to their neighboring countries instead of dangerously traveling across oceans and blaming us when their children drown, but that's another topic.)

If you ignore the political correctness for a moment... what is actually wrong with Islamophobia? 

Islam is a SUPREMACIST religion...

How much evidence do we need to see to say that Islam is somewhat problematic and antithetical to western values?

1. They have their own segregated schools which often score extremely low on Ofsted (an evaluation carried out on schools) 

2. You will find a hard time finding a non-Halal restaurant in many big cities here in the UK, which includes fast food restaurants.. no KFC here sells bacon, all Subways are halal only for example. KFC was forced to remove alcohol wipes because of complaints.

3. We're afraid to criticize Muslims because we know there are greater repercussions than criticizing say Christians, Jews, etc.  (Charlie Hebdo)

4. Misogynist ideals, the burqa is NOT empowering, if it was why is it black and not a nice material?  'Men are the maintainers of women' 

5. Homophobic... homosexuality punishable by death.

6. They outbreed every country they come too, the majority of Islam countries were not always Islamic. 
How can we disregard that fact in Western countries? Not in our lifetime but a few hundred years would be a different story. We only have to look at cities in the Midlands to see it already happening and the fairytale ideal of integration is just not happening, they segregate themselves often because they do not speak a word of English.

Just because we put these backward ideals under the cloak of religion we have to accept it?  We have to ask ourselves... do countries become better, the same or worse with mass Islamic immigration? I feel we know the answer.",0,0
2475,59250671,6033737,"   
You still can't get you head around it can you... 

Achluophobia - Fear of darkness
Venustraphobia - Fear of beautiful women

You see the only two things the above have in common is that they're phobias, they are not equal.. one is rational, the other, irrational. (If we take ourselves away from the actual definition of a phobia).

Equating the fear of gay people as no different from the fear of Islam followers is beyond ridiculous.... 

Of course not all Muslims are the same, I have muslim friends that fornicate before marriage and drink... my problem is the ideology of the faith they follow, not the people themselves.",0,0
2476,59245660,6033737,"   
Even tho you don't wanna talk about this point, I wanna share my opinion. They come in Europe because of two big factors:
1. Europe wants workers that's why Europe allows this
2. Freedom in which they cannon't find in any muslim country. Also rich muslim Countries aren't accepting any muslim immigrants from Irak, Syria, Egypt, Afghanistan ect...

For point 1 and 2 I don't have any comment because I don't have any knowledge about these issues. Point three I also find it ridiculous why everybody that has a point about Islam which sounds 'bad' but true get's attacked and get's called a RACIST. I qoute this is an opinion that I've heard from an Imam that said that the part from Buqka which covers the face shoudn't be allowed because we as civilians need to identify one another. As for the part that covers the hair and neck I don't see it as a problem. Now if a women wears Buqka because she is force from her husband it's another thing. Are there any cases? I can for sure say YES and there are a lot. TBH homosexuality is punishable by death also by other religions. Probably you took this in consideration just because we have seen cases/videos where muslims kill homosexual people, which is a crime. Now point 6, Imams are consistently sharing birth ratio stats between western countries and muslim countrys, in a way that they make it look as a big victory, also encouraging muslims to make more children. In Islam is prohibited to stay single. This is the only reason why Islam is the fastest rising religion at this moment. Also as a point 7 i would suggest you to add that they are consistantly giving hate speeches in mosques about western countries which is totally ridiculous seeing that only western countries are helping them.",0,0
2477,59253609,6033737,"   I am not going to get into this thread a lot of false information is being spread but I will just say this. 

Tawbah is during the time of war battle of Tabuk you cannot just cherry pick verses and say hey this is the ruling without knowing the actual story behind the verse, and if you read the Quran it also says not to transgress limits.

Oh as for the whole Hijab situation the Bible says women are to cover as well.",0,0
2478,59253382,6033737,"   
Yes it has.
   

   
What a lot of people refer to as ""jihad"" is really a separate but very related doctrine called salafist jihad, which is the ideology behind 9/11.
   

   
1. Then it isn't a real Muslim school.
2. True, drinking alcohol isn't good for you. But when people start whining and complaining, why should that choice be removed for everyone? There are much worse things you can do to yourself.
3. I think he means criticizing Islam in general. You can speak out against Christians all you want and barely anyone would bat an eye. But the second you start speaking against Islam, you can expect a massive backlash from both Muslims and virtue signalling crybabies.
4. All female believers are required to wear a covering or veil of sorts.    
5. Most of the Quran's punishments are quite dated. I fully support the death penalty for rape, but most of the rest of it is utter bollocks.
6. Reproduction is a human right, but in many (sane) people's minds, it becomes a problem when foreigners become the majority. This allows them to overpower the native population both culturally and politically and make them minorities in their own homes, but this is for another discussion.



   
Breivik's attack was a far right attack. He isn't even a Christian. He describes himself as an Odinist, which is apparently a type of modern Paganism.",0,0
2479,59253105,6033737,"   
Ill try to sound as nice as possible, this alone almost shows that 1. you haven't talked to a faithful muslim,
NO WHERE IN THE ENTIRE QURAN OR ANY Phrase by the prophet muhammed has it ever been commanded to attack non-believers
If anything I'll show proof that it's the total opposite, 
allah is with those who are righteous and those who do good (16:129) 
respect and honor all human beings irrespective of their religion, color sex, language, status, birth, profession/job (17:70)
and so on you can go on peacetv.com for a huge list, of commandments for peace, 
A lot of people scream 'REEE' against the word 'jihad', Jihad is a commandment against tyrannical rulers, NOT AGAINST NON BELIEVERS, 

and replying to OP thread:
1. You can join a muslim school without being muslim 80% of them allow this. 
2. I'm sorry but do i really need to show you scientific evidence about the damage alcohol does the to the brain, but hey your life you do you, swerve how you swerve just dont swerve to my lane.
3. Most muslims accept criticism but only when the criticizer is open to logical discussion, go on youtube there are 4 hour stand off logical arguments between muslims and christians etc, with high rates of transfers in to islam.
4.  uhh what? most muslims dont even wear a burqa its 1. optional and 2. at this day and age only a tradition for countries like aghanistan, most females now wear a 'hijab' which is not limited to color nor material, you decide those things.
5. homosexuality punished by death yea, stealing = you get ur hand cut off, rape = death, and so on, don't think they apply to our current generation/century, and i honestly dont know what happened to these laws, islamic scientists found them to be 'impractical'. 
6. this one is just nonsense 'they out breed' isn't that like a human right? oh yea it is completely stupid point and doesn't support your argument at all.

I'm sorry that 1.8 billion people believe in islam, maybe that should say something to its legitimacy but that's another talk for another time, I hope you learn from this, 
have fun brother.",0,0
2480,59253736,6033737,"   
Taken out of context.

 Quote:What a lot of people refer to as ""jihad"" is really a separate but very related doctrine called salafist jihad, which is the ideology behind 9/11.
    

Wikipedia still not accepted as a source college wise nor regular school cirriculum.

 Quote:1. Then it isn't a real Muslim school.
2. True, drinking alcohol isn't good for you. But when people start whining and complaining, why should that choice be removed for everyone? There are much worse things you can do to yourself.
3. I think he means criticizing Islam in general. You can speak out against Christians all you want and barely anyone would bat an eye. But the second you start speaking against Islam, you can expect a massive backlash from both Muslims and virtue signalling crybabies.
4. All female believers are required to wear a covering or veil of sorts.    
5. Most of the Quran's punishments are quite dated. I fully support the death penalty for rape, but most of the rest of it is utter bollocks.
6. Reproduction is a human right, but in many (sane) people's minds, it becomes a problem when foreigners become the majority. This allows them to overpower the native population both culturally and politically and make them minorities in their own homes, but this is for another discussion. 

^^
*Christians allow non Christians in their school. That doesn't automatically denote the schools religious institution.
*Read up, think I covered the choice not being removed as well due to voices speaking out. I think it also states they aren't use to countries that are not governed by religion. And thus need to be argued with and contested no matter the anger from them.
*People ""speaking"" out is one thing. When it's complete and utter hatred with weak arguementative points you denote your own validity.
*I think there is too many people in the first place. 7.53B people exist. That is too much in my opinion.

 Quote:Breivik's attack was a far right attack. He isn't even a Christian. He describes himself as an Odinist, which is apparently a type of modern Paganism. 
^ This needs a source as well as the initial claim.

   
You quote verses and twist the meaning like Christians do. So you can validate yourself.
So the true question is here. 
Are all Christians extremist? Because there were Christians who have killed innocent people in their own belief.

Can't be the pot calling the kettle black.",0,0
2481,59253717,6033737,"   
I'm not really cherry picking anything. The Quran really does teach these things. As for the history of the Quran and the contexts behind its teachings, I really don't care. I'm not a Muslim and I don't care about the 'deeper meanings' behind what's written in their holy book. I imagine not many people in the West care either. What's written in the Quran is still written in it regardless. 

Muslims are instructed to terrorize nonbelievers.
   

Muslims are told by Allah to ""strike from them   every fingertip.""
   

According to this, non-Muslims must convert or risk execution.
   

Muslims are given the freedom to invade and pillage as they please.
   

Extending on the above, Muslims are essentially told to fight against nonbelievers and ""manifest it   over all religion.""
   
   

   
Not an argument and off topic, but while we're on the topic of women, the Quran contains mathematical definitions for the worth of a woman compared to that of a man. 
   

Women are expected to obey their husbands without question. If a man's wife disobeys him, he has the right to ""strike"" her.
   

Men are established as superior to women.
   

Women are established as unclean.
   ",0,0
2482,59268055,6033737,"   
A small contribution...Islamophobia is not a word. Phobia is an irrational fear. Islam's history is replete with murder, pillaging, rape, mayhem....basically the lowest human scum all grouped in one. A fear of of Islam and it's follower is a self-preservation instinct kicking in..which the leftists work hard to nullify with fancy words like racist, xenophobic, sexist, anti-LGBTQRSTUVWYXz...ETC. You should call it repulsion..like when you see vomit. Islamorepulsion should be a word. Also, Islam is not a race....so it is logically not possible to be racist if you hate islam.

   
Oh...cute boy...reads news...!!..Kudos..but..cute boy..never read Islamic History. US just realized these people are crazy fucks. Just tell them Islam is in danger and they will blow themselves up. The expansion of Islam in Europe i.e Spain, ME, etc...when it happened there was no USA to make a fool out of them..it was sheer butchery..which is ingrained in their fake faith...against non-muslims. I actually like non-muslims who defend islam..they are the first to get their throat slits by islamic peacefuls like christians of Syria...keep digging your own graves.

Also..This argument..Hey! All Muslims are not bad!!!....Are the non-muslims supposed to wait till the day till ALL of them turn bad??? Enough of them are more than enough poisonous insects to question their scumbag fake faith..which allows ""lying"" to non-muslims..(AL-TAQQIYA)..allows rape...allows murder..allows ..slaves...So called peaceful Muslim is doing his own Jihad by breeding and having romantic relations with non-muslim women...then converting them to islam.  The woman is the most important object in islam. there are like a 100 rules for her. They know the woman is the child bearer..if she is exposed to any foreign ideology..islam will die..that is why the purdah, the hijab, the black bag etc...their women are untouchables for non-muslims...they are smart...non-muslims are dumb fucks.",0,0
2483,59266448,6033737,"itt: people getting mad and virtue signaling how open and tolerant they are despite the obvious risks involved with importing droves of people who subscribe to a religion that subjugates women and freedom in general and is 5000 years without reform

yeah real smart lefties",0,0
2484,59278868,6033737,"   
I was on my phone and didn't feel like spoon feeding you everything kid

   
Whats your point? You'd sure hope so!

   You said it yourself, you can't speak for the UK... 51% of the lamb, 31% of chicken, and 7% of beef is now religiously killed in the UK.

   Woaaah be careful a few hurtful comments Scary! 

   
Black fabric is not considered beautiful, to seriously pretend that it is a wonderful garment to empower womens religious freedom is down right COMICAL.  Why isn't it nice flowing white silk? 

   Not sure why you are focusing on Christianity as if I'm Christian, two wrongs don't make a right.. at least they aren't actively throwing them from buildings and murdering them.. unlike another religion I can think of.

   What the fugg are you talking about here? 

   
Mhm keep believing more Clay Davis you're fed by your lefty echo chamber...  Boris didn't win because of racism, he won because people feared a Jeremy Corbyn communist government and in part because people are fed up with the long brexit process and just want to leave. But labour don't want to take that blame, they'd rather blame it on imaginary racism. very cool.

   Religion, Culture, same difference.   Islamic ideology is not safe.

   
'Racist'... yeah thinking all religions are dangerous but realising on a basic survival instinct level that Islamic ideology is not safe for western countries is definitely 'RACIST' you waste of space.",0,0
2485,59275878,6033737," Quote:1. They have their own segregated schools which often score extremely low on Ofsted (an evaluation carried out on schools) 

I've seen a lot more ""Christian"" schools than ""Muslim"" schools in Sweden.

 Quote:2. You will find a hard time finding a non-Halal restaurant in many big cities here in the UK, which includes fast food restaurants.. no KFC here sells bacon, all Subways are halal only for example. KFC was forced to remove alcohol wipes because of complaints. 

Can't speak for the UK, but there isn't a single halal-only restaurant in Sweden that i know of.

 Quote:3. We're afraid to criticize Muslims because we know there are greater repercussions than criticizing say Christians, Jews, etc.  (Charlie Hebdo) 

Have you seen the backlash the last couple of days because of some series Netflix produced where Jesus is gay or something along those lines?

 Quote:4. Misogynist ideals, the burqa is NOT empowering, if it was why is it black and not a nice material?  'Men are the maintainers of women' 

What does the colour of a garment have anything to do with anything? This is one point where we might agree on somewhat since i don't support burqas either (but i support hijabis).

 Quote:5. Homophobic... homosexuality punishable by death. 

Mate, have you been to a church recently? The one i attended not too long ago strictly forbids homosexuality.

 Quote:6. They outbreed every country they come too, the majority of Islam countries were not always Islamic.
How can we disregard that fact in Western countries? Not in our lifetime but a few hundred years would be a different story. We only have to look at cities in the Midlands to see it already happening and the fairytale ideal of integration is just not happening, they segregate themselves often because they do not speak a word of English. 

Even though i'm from a great country with amazing possibilities i have to admit that when it comes to language the natives are Clay Davis so what's the point?

Maybe if countries like yours and mine didn't sell weapons to totalitarian goverments they wouldn't bomb the other countries and thus the immigration wouldn't happen. Also, i know that nonce BoJo just won but damn ya'll brits really got bold with your racism all of a sudden.

You're also confusing religion with culture, Malayisa is more progressive than western societys in some aspects while countries like Saudi are conservative. But the common denominator is that they're both muslim countries.

If you want to be racist atleast get your facts right.",0,0
2486,59270296,6035683,"I read this in Charles Bukowski's voice.

Those who preach god, need god
Those who preach peace, do not have peace
Those who preach love, do not have love

Beware the preachers
Beware the knowers
They're afraid of what they do not know

Beware those quick to praise
For they need praise in return
Beware those who seek constant crowds
For they are nothing alone

Beware the average man or the average woman
Beware their love, their love is average
Seeks average

But there is genius in their hatred
There is enough genius in their hatred to kill you
To kill anybody
Not wanting solitude
Not understanding solitude
They will attempt to destroy anything
That differs from their own
Not being able to create art
They will not understand art
They will consider their failure as creators
Only as a failure of the world

Not being able to love fully
They will believe your love incomplete
And then they will hate you
And their hatred will be perfect

Like a shining diamond
Like a knife
Like a mountain
Like a tiger
Like hemlock

Their finest art",0,0
2487,59208297,6030772,"It's convenient to be a socialist and blame someone/something else for a problem. Some male socialist are that way because of the stigma that comes with being a conservative and rather have easy statist women rather than strong independent conservative women. 

Most of these children advocating for socialism aren't seeing the bigger picture when it comes to socialism and what a real socialist society looks like they just envision a utopia that won't ever exist. Most conservatives and liberals are both big government collectivists and are all basically socialists certainly in the UK.",0,0
2488,59227632,6031812,"she had her chance, still kinda curious if she still wants to be the first female president of the USA",0,0
2489,59275102,6036394,"Aria, Girls Last Tour and Strike Witches",0,0
2490,59212471,6030706,"   
By simply asking this question you answer it. if it was good you wouldn't be asking this question. You are asking other people because something bothers you. Killing a bad person is doing the same action the person that you dimmed bad did. killing is wrong. If you don’t believe that, what do you have against the people who killed this girl in the first place?  To say “killing justifies killing,” is a logical absurdism. It is like capital punishment, killing the killer because it is wrong to kill.",0,0
2491,59254480,6031401,"I watch because the stories are more interesting and just straight out better then most TV shows on today. As well as you arent really bogged down by reality, anime creators can create anything they can imagine without needing crazy expensive CGI. So whatever someone wants to make they can make and also not get it castrated in the media for being racist or sexiest etc.. Try taking an anime and putting it in real life, you need actors and CGI with producers etc... everyone saw what happened with Death Notes live action film. It took a great anime and pretty much fugged it, and anyone who has never seen the original anime thought it was good.... Its like taking a kid that eats jelly beans for dinner and giving him peanut butter and jelly sandwich. That kid will think that sandwich its a medium rare steak with potatoes.  

Or maybes its because the girls in the anime can be very cute sometimes in ways real life people cant be:)",0,0
2492,59216194,6031401,"I might recommend having that for fat-women addict haters or anti fat-women addicts.

But, i'm not too thrilled for it. : \


p.s - i'm not a fan of fat-women addicts irl",0,0
2493,59259330,6035093,"   I love looking at some thick chicks. She may sit of my face till I can't breathe no more, damn, what a beautiful woman     All jokes aside, this is repulsive to me too but there are some people out there who really love a thick woman like this. I love some 'chubby' booty or anything that isn't that Victoria Model stick thick.. A healthy well formed body appeals most to me. 

   I think that the USA and other parts of the world are making 'extraordinary' normal and everybody that disagrees will be boo'd, sued or made fun of by the media.
More than 2 genders.. not in my world. Try telling a woman that she's a woman, you'll be sued for 'gender' fortification or whatever.
Thick is sexy and proud.. not in my world. Try telling a woman she's too fat to be beautiful.. she's unhealthy. You'll be publicly ashamed! Now tell a guy he's too short.. every woman agrees. 

I think there are too many 'double standards' in the world and this is one of the many provoking matters that will end up in a big discussion. Don't 'fight' the crime against unhealthy food being made cheaper than a f*cking salad.. nope! Just be proud of your obese and encourage others to stay unhealthy. This is wrong in so many things in my eyes.

Long story short; I love a woman that isn't a tree stick, but I don't want them unhealthy thick. Shouldn't be encouraged.",0,0
