Unnamed: 0,IdPost,Thread,Content Cleaned,Label,Sentiment,0 Mistakenly filtered,1 Sex,2 Relationships,3 eWhoring,4 Online crime,5 -Descriptions,6 - Abuse,7 - Politics,8 - Skills,9 -Story
1465,59058394,6016690,"In my opinion, men have it way harder than women in this world.

In society today (well, at least Western society), men are expected to be strong, stable (both financially and mentally), good looking, tall, etc. They are expected to always make the first move and pay the entire bill for dates. Meanwhile all women are expected to do is to look pretty and be loyal. Literally a decent looking female can get almost anything in today's world since there are a ton of lonely guys who are thirsty for attention from a female.

Women today have so many advantages that make their life so much easier. For example, men have no right to talk about abortion since it's ""her body, her choice."" Stuff like this leads to men having to pay a ton of child support for a child they don't want, and they have no right to refuse to pay this. Let's also not forget about how it is frowned upon for a man to hit a female but not frowned upon for a female to hit a male. You can literally see hundreds of videos about this on YouTube where no one interferes when a female attacks a man, but when the man defends himself from the female, everyone gangs up on him saying it's not right and he ""shouldn't hit a girl."" Shall I also bring up rape accusations? If a man says that he was raped by a female, almost everybody will laugh at him since majority of people today believe that a ""man can not get raped."" But if a female is raped by a man, hell will be unleashed on that guy, accused or not. Don't believe me? Go look up articles about teachers having sex with young students and read the comments. If it's a good looking female teacher having a relationship with a male student, a ton of people will cheer it on saying that he is ""lucky."" If it's a male teacher having a relationship with a female student, people will call him a creep who took advantage of her.",7,N,,,,,,,,,,
1466,59058282,6016690,Women definitely have a greater opportunity to have a more relaxed life at the expense of men.,7,N,,,,,,,,,,
1467,59058242,6016690,"   
i mean im not so sure about that since alot of women get desk jobs even if a man could do it",7,N,,,,,,,,,,
1468,59058229,6016690,"Women have it harder because they aren't capable of the same physical output as a man, which puts them at a competitive disadvantage in the workforce.  Plus, being stricken with menstruation every month has got to be really inconvenient.",7,0,,,,,,,,,,
1469,59058214,6016690,"We both have it difficult in different ways I would say. I'm sure many women would be incapable of doing what I can do and I would be incapable of fulfilling roles a lot of women are good at. We are different, this is a fact.",7,0,,,,,,,,,,
1470,59058210,6016690,"   
Just because you think a ""female"" is only obligated to do so it's kinda sexist, Men can also raise kids perfectly fine without a mother or if the mother is working? 

Not really even a good topic due to both genders have flaws, there is always going to be pro's and con's equally.",7,0,,,,,,,,,,
1471,59058209,6016690,"Probably women, they do all the cooking, cleaning, holding the kids usually. But I mean, no money = no food = no kid = no wife haha.

Unless the dad is a stay-at-home dad and the mom works. Vice-versa.",7,0,,,,,,,,,,
1472,59058203,6016690,"Do men or women have it harder in this world?

as each side is compelling as will get users who says its the man since he the bread winner. then will gets users who say its the woman cause she cooks, cleans and raises the kids",7,0,,,,,,,,,,
1473,59070672,6016690,"   
By that logic -

toothache can be so severe grown men require epidural anaesthesia
childbirth can be so severe that women die

death is worse than epidural anaesthesia, childbirth is worse.",7,0,,,,,,,,,,
1474,59070631,6016690,Woman for the simple fact they give birth.,7,0,,,,,,,,,,
1475,59070600,6016690,"   
Giving birth is a natural process it isn't even that painful, it's a short temporary pain most women feel consumed with happiness right after.
If it were so extremely painful I doubt you would have women wanting more than one child.

Men can also experience things far more painful than childbirth from broken bones, toothache, and gallstones.",7,N,,,,,,,,,,
1476,59070520,6016690,"For me its the women,You cant compare anything to giving birth,Period!",7,0,,,,,,,,,,
1477,59070252,6016690,"Both genders face their own challenges throughout life, but if I'd have to pick one then I'd say that women have it harder if you could measure it statistically. I am very happy to be male in this world.",7,0,,,,,,,,,,
1478,59066831,6016690,"   
Yes aware no one here will agree but want to hear opinions from both sides the isle. as i stated in thread men are gonna feel they have it harder due to pressure of making enough money to support the family etc where women are gonna feel they have it harder with raising the kid(s) and cooking dinner, getting kids ready for school etc.",7,0,,,,,,,,,,
1479,59072118,6016690,"Depends honestly, men have it rough so do women. id say 60/40 men have it more rough",7,0,,,,,,,,,,
1480,59070784,6016690,"It is pretty easy to say that men have it harder than women, period. It is also not terribly difficult to figure out how unpopular/unacceptable that is in modern mainstream society.

Just go look for articles such as ""Men account for 99.9% of deaths in war, Women most affected"", or ""Women are replacing men in the workforce @ 4x the previous rate, Here's why that's bad for women"", or ""Men make up more the 90% of the homeless, Women most affected"", or ""New study finds that 80%+ of Male suicide happens after divorce or custody battles, Here's why that's bad for women, and what can we do about it"".  The fundamental point is that almost every. single. society. ever.... has placed the physical security and emotional well-being of females at the top of its priority list because the health and security of a society's females is a precursor to the health and continuation of that society. Even though societies often have different interpretations of what that means, it isn't terribly difficult to notice how it plays out when you have constant clashes every day in most modern Western nations regarding the proper value, care, and treatment of females in public life between the native Western cultures, and the invading hordes of 'refugees'/'economic migrants' from the Muslim Middle East. 

People from the west look at the muslims and say, ""How horribly they treat their women, making them dress up in great big black bags with only a letter box for their eyes; and they never let them go anywhere in public alone or drive..."" Meanwhile, the Muslims look at the 'modern', 'independent' Western females, and say, ""Look at how carelessly they treat their women, they don't cover them up to protect them from the <male gaze>, they don't discipline their women for acting out, and they let them go everywhere by themselves not caring if they were to be assaulted or raped by other stranger men.""

The simple fact of the matter is that almost every societal standard for conduct, decency, action, and responsibility has ultimately been one created with the thought of the well-being of females and ultimately their implied future children, no matter how barbaric it may seem to our modern Western sensibilities.

The facts are that men have always been the top providers for families, have been the top workers, top thinkers, the ones shouldering the majority of the burdens for provisioning societies, have long been the first ones to die in the protection of their families and societies, and are invariably the ones that suffer the most severe consequences when things go wrong. And men are expected to do this without complaint, or to work harder to make things better if they don't like it.",7,N,,,,,,,,,,
1481,59060828,6016641,"Eventually we will get there. I think that part of the reason we haven't done that yet, is because that people in severe pain are more likely to opt in for experimental treatments/clinical trials. A doctor can't just perform treatments to anyone without his approval (let alone experimental treatments). 

My grandma died from breast cancer and as hundreds of thousands of women in the 90s got radiotherapy. Today we know that radiotherapy has to be used in moderation otherwise it makes patients worse.

It is a harsh life for all of us, I see our endurance in illness as a way to contribute to the human collective knowledge of what can make a human recover. When I get ill (hopefully in old age) I hope that I will have the courage to tolerate treatments as well.",9,0,,,,,,,,,,
1482,59073955,6018151,"Hello, 

The first time I encountered it I was like 13 years old, I slept near a dresser which was a little bit upper of my bed.

I was sleeping on the back, looking the ceiling, and a dead women came from up of me, flying slowly to me in the other sense I was sleeping and screaming. I'll never forget that. (I was layed like the women of your picture and the dead women in my sleep paralysis came from the right of the image and facing me, just flying up and front of me).

I was very disturbed by that, it happened like 3 or 4 times in 10 years. Then it happened more often, so I searched about it on the Internet and I understood.

Know it happens about between 1 or 2 times a week, sometimes I wake up suddenly, realize, try to sleep, and it starts again directly. So I wake up few minutes, drink a bit of water, go on my phone, and then I go back to sleep, and it's fine.

I learned to live with, not sure if there is something to avoid that.",9,0,,,,,,,,,,
1483,59064929,6017259,"   
Yeah, because demeaning and berating them has been proven to be healthy practices... 

   

This girl was 10 years old and she became an hero after being bullied.",9,0,,,,,,,,,,
1484,59072178,6017259,"   
Dopamine rush would make more sense considering dopamine is the precursor to serotonin and the reward center is a more important system then just serotonin on its own which produces just pleasure but dopamine is why the concept of craving or desires exist, its been proven in medical literature that parkinsons patients that took l-dopa which in some rare scenarios caused them to desire/crave more things then the general baseline amount, one guy became a sex addict and his wife had to call the cops to get him to stop, another gambled for ten hours instead of just two and finally a woman craved tons of junk food and became a binge eater. All of this resolved once the patients stopped taking l-dopa so we already know from studies too much dopamine and too little dopamine is bad there has to be a balance. “Addiction” in this context could just be another word for craving and desire so this is another theory of mine on why people may get confused about addiction existing or not. What people call addiction may very well just refer to craving something so if were talking addiction existing in the context of neuroscience and not psychology then potentially it can be measured via dopamine levels obtained from a blood profile and the higher it is the more people will crave anything that gives them dopamine rushes.",9,0,,,,,,,,,,
1485,59066816,6016486,   KYS woman,0,0,,,,,,,,,,
1486,59061693,6016990,    please help this undeserving scorned mentally ruined female get closure and ending to this 7 year painful experience..    ,9,0,,,,,,,,,,
1487,59099909,5963394,"For me I get the best luck from people in the USA and Canada. Specifically when I go for people in more conservative middle of nowhere type places. They're red necks, but they have nothing better to do than pay some girl on snapchat so I don't mind them.",9,0,,,,,,,,,,
1488,58410738,5954684,What sites do you guys use? I have a girl trying to get into something like this so LITERALLY asking for a friend.,9,0,,,,,,,,,,
1489,58427185,5954684,"   
There is however a next level of earning that can be done if you have a female trying to get into it. Which is what I am trying to help someone with right now.",9,0,,,,,,,,,,
1490,58427176,5954684,"   
I'm pretty sure if you're spending your spare time making old men horny by pretending to be a female, then you're already a latent homosexual. Any rebuttal of ""BUT MONEYZ"" is just an unwillingness to step outta dat closet.",9,0,,,,,,,,,,
1491,59089359,6019576,"   
not even sure if it works anymore, but you use the sticker feature on snapchat and make a sticker of a whole photo of your girl and then take a snap, put the sticker on and align it so it looks like a real picture, but pretty sure it either doesn't work at all anymore or the quality is shite",3,0,Not enough detail to tell which category,,,,,,,,,
1492,59076974,6017364,"Second girl looks hot, could I get the pack? Thanks a lot op!",3,0,,,,,,,,,,
1493,59096106,6020027,"Snap is getting tougher and tougher about that. They need the ad revenue and they don't want the sexual side of the app chasing away advertisers.  Ironically, I think it will send real women and ewhores back to Kik and to Telegram.",3,0,,,,,,,,,,
1494,59096587,6020027,"   
Not really. There are women and ewhores making more in a day on Kik than some are making in a week on Snapchat. Platforms don't really matter. Technique does.",3,0,,,,,,,,,,
1495,59097539,6020364,Snapchat because a lot of real girls do the same.,3,0,Not enough detail to tell which category,,,,,,,,,
1496,59063346,6017008,"I'm having trouble getting any customers, they always ask for a cam chat to make sure that its really a girl and I never make anything, plus I dont have any verifications, and VCW's wont load",3,0,Not enough detail to tell which category,,,,,,,,,
1497,59073550,6017008,"   
Okay hopefully your right, it'd suck if I went to jail for pretending to be a girl and selling nudes online... imagine explaining that to ur parents.     ",3,0,,,,,,,,,,
1498,59097976,6020408,"Hei there awesome e-whores. I just found out about the term ""e-whoring"" and i want to ask a few questions that i can barely find anywhere.
I learned in the past days how this thing works, at general level, and i think i got some external sources where i can find some pretty good images with e-girls. My questions are mostly about where you guys do your activity, where did you start from, or where you got the clients from?
I saw here bunch of threads about selling packs with girls. You make an account for every girl you have photos of? How do you find your costumers?
I saw most of you recommend AGC(amazon gift card) as payment. Why paypal isnt as good? They can do refund? There s anywhere some free tips for start where i can find more about this? I dont mind to pay some bucks to find out things, but i need to know properly if this Clay Davis fits and its profitable or still works.
Any more infos related about this topic and startup tips would be highly appreciated. Thanks!!",3,0,,,,,,,,,,
1499,59097947,6020406,"I want some specific verification pics. Girl does not matter. I prefer good looking nice body girls. They can be from all different girls i dont mind.
Its listed below...

- Pinky touching chin.
- Pinky touching nose.
- Pinky touching ear.
- Pinky touching chick.
- Pinky sucking.
- A selfy with pinky touching the thumbs.
- Pinky touching lips.
- Pinky touching tongue.
- Middle finger while an eye shut. Wink + middle finger in single selfy.
- Tongue out + middle finger in single selfy.

Let me know if you can do it.",3,0,,,,,,,,,,
1500,59095881,6020187,"So I found this quite successful back in my eWhoring days. It has been a few years, I was really successful but I wanted to take a longer break, then eh, life happened and I stopped completely. I'm getting back into the game, investing in some stuff, so I just wanna share a tip with you all.

This offer really attracted lots of people and they usually keep coming back for more. 

-Sexting Session With Live Pics-
Get yourself a good pack, or the one you use now. Find 15-20 consecutive pics where the girl is in the same outfit, and put them in the order from most clothed to fully nude, so like a strip show. Actually sext with the guy, and gradually send live pics. 
You can sell these in 30min or 1hour sessions. Don't go low on the prices, because guys pay a lot of money for this. Yea you might get a peen pic or two but eh, its easy money right?

Good luck!",3,0,,,,,,,,,,
1501,59095886,6020068,"You'll pretty much need a phone for Snapchat. 
But if they are real girls willing to provide any material (proofs/pics/kinky requests...) you can still earn a bank on KiK. Good luck!",3,0,,,,,,,,,,
1502,59094686,6020068,"I have two girls willing to find different sources of income since this is better and more private to them.
(Doing it trough apps/websites and not streaming platforms ) 
Which way should I go about this?
Snapchat? if so , I would need a decent guide on using snapchat off PC.


Thanks in advance, Good luck with earnings.",3,0,Not enough detail to tell which category,,,,,,,,,
1503,59087962,6019228,"   

There's a lot of information in the internet even if you are a girl and you don't have self esteem that you can ewhore well it's pretty much useless. Even if you already have mentor, if you don't believe in yourself that you can do it then its pretty much useless. Because what made you do the action? It is self esteem man.",3,0,,,,,,,,,,
1504,59087755,6019228,"   That's a dumb way to do business.
Guys don't wanna pay for premium.
They wanna throw 10 dollars down on a girl and thats it. Dont offer subscription based stuff unless they want ir.",3,0,Not enough detail to tell which category,,,,,,,,,
1505,59092359,6019846,"I don't like the e-whore concept with the idea of having a boner because you get horny from your own imagination while talking with guys. im out.

I do like your approach, but still... talking to a guy for maybe weeks to get some money makes me think of those filthy Nigerians scamming elder women.",3,N,,,,,,,,,,
1506,59092182,6019846,"After seeing e-whoring section that used to be a goldmine to its current state that is all about old threads with packs and old methods I want to give my support after taking the motivation from  spiral   and  CyberError   who posted some fresh content.

In this short guide I will try to help you how to approach the clients once they added you.
One main mistake many new guys do is that they sell only nudes and vids, thus the ""sell ice to Eskimos"". Lets be real guys, those dudes who added you can find nudes of various girls within seconds... What do they cant find so quick? Keyword, interaction.
Thats what i mean with ""sell blankets to them"". Think logically, those dudes ended up on internet to look for sexual company, meaning they cant find it on real world. Sell company to them. Dont sell ""goods"", sell services. For example, my best seller always was sexting with live pics (till you cum). Thats something that will take their interest since you are committed to them for an amount of time. 

Also, its not either kik or snap. Dont think you cant take the advantages of both to your side. I always use the Lifetime Premium option in kik and it sells like hot cakes. Why? Because most think since its kik I will always send pics and vids and they missing the the big potential of the premium membership. Remember lifetime=content for ever, in their minds and they like this.

My point with this thread is to help you understand that you should have a big and creative price list in order to get their interest. Try to include commitment and interaction into your services and think how many new sales you gonna get!

If you guys like some small, straight to the point threads, like this one please tell me and ill try to write and post more for you(have some ideas already in my head that could help).     

#MakeEwhoringGreatAgain!",3,0,,,,,,,,,,
1507,59090907,6019313,   Just ask a girl to wear some panties for a bit lmao,3,N,,,,,,,,,,
1508,59094070,681714,"   
I can vouch for this. I used an asian girls pics back when Kik was still super good and dear GOD it was insane!",3,0,,,,,,,,,,
1509,59093454,6019953,Nope. Girls for some reason are more likely to report you (jealousy is a bitch I suppose) and people from third world countries 99% of the time won't buy anything. Why add traffic if it's trash traffic?,3,N,,,,,,,,,,
1510,59093441,6019953,Always girls and arabs. Do you add these people just to boost score?,5,N,,,,,,,,,,
1511,59072494,6018016,"Just finished coding a very simple username scraper that can scrape TONS of usernames. At the moment it only scrapes from one website but I am planning on adding multiple options and adding more filters like male/female and so on.

At the moment it only scrapes females, but adding a gender option wouldn't be much of a challenge either.

Are you guys interested in something like this? If so, reply to the thread for the download link.

Made in C#      


   


UPDATE 1: added the ability to copy a username to a clipboard. So you can click a username, then hit the enter key on your keyboard once the username is highlighted and it will automatically copy the username to your clipboard and you can paste it wherever you want (snapchat or whatever it may be). 

UPDATE 2: Added the ability to filter male, female or BOTH. In addition, cleaned up the design slightly
   
Future plans: 
- Plan to add the option to save usernames to a .txt file.
- Plan to add more websites to scrape from.",9,0,,,,,,,,,,
1512,59073336,6018016,"   
   
For now unfortunately you have to be l33t or ub3r I will let you know though     

UPDATED the scraper, better UI and option to filter male / female / both.",9,0,,,,,,,,,,
1513,59091852,6019818,"Hello

I recently got access to a lot of mega.nz accounts with some nice ewhore content.
There are a lot of different girls with a lot of pictures and some of them have videos as well.
I was wondering if this could have interest to some of those who ewhore, then In the future I might organize it and sell some packs cheap.

Let me know if you have any feedback.",3,0,,,,,,,,,,
1514,59089813,6019634,"Find another pack, preferably from a girl that’s still active on social media, so you can grow your content. Have shorter but also longer vids ready and upsell the longer ones as “special and exclusive and super private” to your recurring clients. Upload the longer vids to a share server where they can watch the video. If it’s good, they’ll come back for more without any effort from your side.",3,0,,,,,,,,,,
1515,59084653,6019169,"   
You are a real girl. You won't really have problems on traffic source. Just don't be desperate and don't sell your photos and videos on a lower price. People here in hf might buy your premium not in the site but in a way they can fnd you so that they can use your resources that's why it's better to sell photos and videos if you are a real girl than to sell premium because premium is what i call selling updates on your daily fetish life.

   
I also encourage you to join discord servers or skype groups so you can be helped on social engineering. I can see your potential to earn 1-5k per day if you add skype video calls with voice. That's what most ewhores can't offer",3,0,,,,,,,,,,
1516,59084532,6019169,Hi everyone this may be a strange question but I just joined HackForums not long ago and just discovered the art of e-whoring and the potential income from it. I myself am a girl and would like to use my own nudes because I can't afford buying packs of other girls nudes but the only thing I'm doubtful about is the success rate of it because I would like to keep my anonymity and not include my face. I don't think I have the biggest boobs or ass but I've been told I have a cute petite curvy body. So my question to you guys is is it possible for me to be successful in this if I only use pictures and videos without my face in it? Any advice is appreciated lol ty,3,0,,,,,,,,,,
1517,59085454,6019169,If your a girl you can make bank just follow the tutorials here minus using eWhore packs,3,0,,,,,,,,,,
1518,59084813,6019187,"anyone here im looking a model video with complete move like wave, anyone can give me for free, new girl video because what i have here is old model, thank you in advanced thank you so much",3,0,,,,,,,,,,
1519,59082417,6018951,"Got nudes of a girl I’ve been using online for awhile now, but I’m looking to make a verification pic. I have some choices, just need someone to photoshop extremely convincingly a paper in the girl’s hand or maybe laying on her body or whatever (well discuss it) with some writing on it. Maybe the date I’ll post it and ‘her’ Patreon account or tumblr I’ve been using to run my grift. I can pay for it, price depends on quality of work basically. I need it to look absolutely legit. (I’ve built a decent following with this girl so I don’t want to use some random chicks pics or anything, hence the verification) 

I know this may or may not be the right place for this but I don’t know anywhere else I can trust with a request like this so I figured I’d ask among fellow ‘e whores’ lol",3,0,,,,,,,,,,
1520,59082359,6018927,"The best advice is to look like a real girl. A real girl would not sell 50 pics and 5 vids for 15$, so never do that. High prices = high reward. Guys that would buy for 15$ would probably buy for 50$, so think about your pricing and your persona. Just try to look legit.",3,0,,,,,,,,,,
1521,59076923,6018297,"   
If you find a woman willing to pay me for nudes, I'll send my nudes lol",3,0,Not enough detail to tell which category,,,,,,,,,
1522,59076739,6018297,"   
Yeah, maybe potentially women too :) do you have any good ones? Their hard to find",9,0,,,,,,,,,,
