Unnamed: 0,IdPost,Thread,Content Cleaned,Label,Sentiment
9000,48650315,5065469,Pretty good amount of hate on this thread lol but i do have to agree that it kind of looks awkward to ask for members to tell you if they're female. Good luck finding your special one ;),0,0
9001,48650279,5065469,"who cares if here are girls?
such bullshit makes you looking like someone who kisses girls asses on the internet because they dont get girls irl",0,0
9002,48650106,5065469,Do doges count as females?,0,0
9003,48650102,5065469,"I am a sexy girl

will sell you my pics for $10",0,0
9004,48650044,5065469,..and this is what happens when you don't have enough of actual real life interaction with women.,0,0
9005,48658528,5065469,Hay bae girl checking in hehe wink wink,0,0
9006,48649611,5065469,"the females on hackforums pop up on their own time.
when they want the attention, they'll make a thread about it. it'll get a shitload of hateful replies, then it'll get junked.

it happens all the time.",0,0
9007,48649588,5065469,I'm the sexiest girl you'll ever meet,0,0
9008,48649006,5065469,"   

People think girls don't have other activities in their lives besides painting their nails and making us sandwiches. I was very good friends with a female member on HF who went by the name of MajorDave and others as well. This site probably consists roughly of it's members being 15% to 20% female.",0,0
9009,48648976,5065469,"   
I use to have a friend who'd leave our party if he read a girls name everytime ""ohh its a girl brb fools""",0,0
9010,48648936,5065469,This is the same when someone is amazed when they hear a girls voice on Xbox live and they get all excited.  Like who cares? Lol,0,0
9011,48648917,5065469,I'm probably the sexiest girl you'll find.,0,0
9012,48648640,5065469,I don't think women that are here want their presence made. Just saying...,0,0
9013,48819492,5081161,"I have a prominent rock musician tag (not for sale!) and I'm looking for a female rock musician tag for my girlfriend. The more well known they are the better and the more I'll pay.

If you don't sell me it but instead help me get to the ball rolling to where I can acquire a good one, I will even pay you a bit....

PM only and a middleman will be used. I won't be dealing off-site for this as I don't use Skype anymore. PayPal preferred, Bitcoin possible too. 

Online now... let's do this.",0,0
9014,48648628,5065469,I'm not sure if you will find some girls on here. How old are you? If you tell me I can recommend some apps for you so you can meet some girls with your interest :).,0,0
9015,48648614,5065469,"Hello Girls on HF,

Post here to make your presence Visible. I am Dying to see some Hacker Girls. There is an old saying there is no girl on Internet (Hacking).

Please prove me wrong.",0,0
9016,28225934,3033404,"I married at the age of 17, wasn't official until I was 18.

Been dating th egirl for almost 6 years.",0,0
9017,53336841,5484979,"HO HO HO merry christmas little boys and girls from hacker forum! i am santa klaus or saint nick... and i deliver ur presents on CHRISTMSS..
 now is ur chance to tell me what u want in real person HO HO HO i hope u bring cookies YUM YUM YUM

now let me tell u something i can see when ur awake i see u when ur sleeping and if u ve been bad u get COAL RAWR
ok yes tell me what u want",0,0
9018,11603951,1259252,"When you look at your RATS directory how do you search for pictures?
I have 5 female RATS, and I am wondering what is the best way to search for their picture folder.",0,0
9019,18060697,1998525,"The video of your girl needs to have the functions that they request. Cut the parts of the video with a Windows Movie Maker that include common ""proof"" requests and play them when they are requested. For example, common one is that they want you to wave to them - have a separate video file that has your girl do just that. To avoid the obvious video editing notice, try to limit your cam showing duration. When they request to see your cam, say that you don't show cam unless for like 5 seconds and only for proof purpose, that way you won't be typing one second and another magically be sitting in a different position showing fingers for them.",0,0
9020,18060335,1998525,I have a big problem. I tried chat-revenue and almost 6 people were interested in my show but the problem is when i start it(the girl just typing) they ask for doing something like show 3 of my fingers so they can know i am real. How you do it guys? It seems all people know that there are fakers and it is almost impossible to find idiot slaves,0,0
9021,18054900,1997877,"Hello guys. I saw that lots of people earn money with this method but i cannot make even a penny with it. I chatted 4 hours today on different chat rooms with this text: 19 years old blonde sexy girl giving 10 minutes full hot webcam show(payment via paypal system) send me pm for details

But havent found anyone,most of them dont want to pay. Tried every chat expect chat-revanue(my hotspot ip is banned). How you get pedos?",0,0
9022,53429632,5492967,Enjoy    ,0,0
9023,41230466,4339104,"   

Well I'm taking it, you got the eWhore pack here on hack forums... In which case, the girl is over 18 years of age. So you got nothing to worry about, so there's no reason to over re-act.",0,0
9024,41230422,4339104,"   

Man chill, are you using girls that are older then 18? Because if so, you got nothing wo worry about..",0,0
9025,48652460,4722440,"Since my first love I cannot imagine myself spending my life with anyone else. All my other girlfriends just don't feel the same.

I've been dating a girl for a little over a year now, but it's just not the same. So right now, unless it was my first love, I do not believe I could spend my life with someone.",0,0
9026,14722785,1608737,"thanks dude :).

the girls pretty ugly but ahwell, thanks :D.",0,0
9027,14703610,1608737,"Here is the link to the girl that is in the Pack

 Here  



Post here and then PM me with the title of pack 1 

will not give link to you if you dont post

this is my first pack tell me if it is good  just got it",0,0
9028,48649126,4722440,"I would like to remain single whole now
as The girl i always wanted to marry
just got engaged :(
Life sucks",0,0
9029,45160379,4722440,I'm going to marry a qt Asian girl when I move to Japan :3,0,0
9030,45164394,4722440,"I'm hoping to get married & settle down with kids, a routine job; all that ordinary lifestyle stuff. I'd like to meet the right girl first, though.",0,0
9031,41229822,4339051,"'Hey'

Man, that is so cringe worthy. Do people actually talk to girls like that? o.e",0,0
9032,41233421,4339308,"   
Ahahaha, I'm sorry to say that I was viewer 30 and 100% of your girls looked about 12 and were pretty nasty.",0,0
9033,53414737,5491293,"   

Yeah it is. Pretty sure eWhoring is the name given to real cam girls as well.",0,0
9034,18042796,1996441,I need videos of non nude girls that are dancing shaking ass ECT ECT i need as many as you guys can help me get also please no watermarks thanks guys!,0,0
9035,41235026,4339430,"   

Yup I just called and hopefully sorted it out, the lady sounded Middle eastern and I could barely understand her jajaja.

   ",0,0
9036,53401707,5490170,"yeah social engineering is the key. they are mainly interested in meeting the girl than just some pics and vids of her. So have a strong story. Like ask em u need to buy something, ask to send AGC or u need to go somewhere urgently ask for paypal money. anything worth counts. But talk to guys who can give. Learn about them before u continue to chat with em..
				
				
				

3wh0r1n9N00b.doc
90@l:$01190/50000 1n1td.jun16
La$t_Updat3:14Ap17",0,0
9037,41231107,4338791,"Use your brain and actually talk like a girl not like the rest of the people in this section who just say ""hunny"" and ""hun"".",0,0
9038,28204060,3032173,"   




Skype: AEIOwnU.HF



If you don't know what RealLifeCam.Com is, Well its a website where theirs Hidden cameras in these people houses, Its like spy cameras to see what they do, And they don't know that the cameras are their, + This is a REAL WEBSITE, Ive also seen some hot ladys getting undressed in one of them. Each camera is in their ""Bedroom/Bathroom/Living Room/Kitchen/Hall+Other"". If you go to their website it only shows you the Living room,Kitchen. But not most of them show you the bathroom or bedroom. 



Payment Method: PayPal/LR

I accept Trades Too

Price for Real Life Cam 1 Month Membership Costs ($5.00) [Price in RealLifeCam.Com costs you $30.00]


Here is some Pic Proof that I myself actually have a Premium Pass to the Bathroom & Bedroom

Picture of a Couple Sleeping!
   



Picture of a Hot Young Girl Sleeping!
   


Please add my skype if you wanna buy. Skype is listed Up!",0,0
9039,28201009,3031826,"I have the codes for Nuketown Zombies Co-op and Multiplayer maps
Exclusive XBOX LIVE Zombie Avater Costume (Both male and female)'
And the Exclusive XBOX LIVE Claw avatar prop

 

My skype is william-m1 (that the fastest way to get a hold of me)",0,0
9040,17002134,1875983,girl from preview looks really hawt,0,0
9041,53366407,5486216,"Ok I'm back and running better than ever! 

Post here and pm me with 2 face pics and a name for your girl and your snapchat name.",0,0
9042,17998608,1991424,"Okay so ive got this guy good, hes given me $20 to do basically nothing and hes payed in advance, so i got the webcam girl and did a finger show for him.. and now i sent him the FBI email, and hes like to me in skype... 

u said u were 19
[2:07:08 PM] Kiara Dickson: What do you mean
[2:07:23 PM] Eric Smith: i got some email saying you were underage
[2:07:27 PM] Kiara Dickson: :|
[2:07:36 PM] Kiara Dickson: From who
[2:07:44 PM] Eric Smith: its a fake.. its ok im not worried about it
[2:07:51 PM] Kiara Dickson: Ok :)
[2:08:23 PM] Eric Smith: have the ice and cup??
[2:08:49 PM] Kiara Dickson: No i got side tracked sorry :P il go get my cup now, and just to clear it up, im not 19, im 17 :P
[2:10:30 PM] Eric Smith: where are u from?


So he thinks its a fake, what can i do from here?",0,0
9043,48672304,5067503,"   

Where I live it doesn't work like that.   The tip gets left on the table and they keep what they get.   The chef gets paid his salary.   Now if the tip is left during the charging of the card I know it gets split up some goes to the person but some goes to the restaurant too.  Its why if my husband gets suckered into leaving a tip for a pretty lady server we always do it on the table.",0,0
9044,17975978,1988319,"If there was an old lady in a Ferrari with 100k in the passenger seat I don't think you'd be able to steal from her, she probably trains in martial arts to keep that money out in the open comfortably. + She kind of deserves it. Heck people break into cars for a quarter, now imagine 100k.",0,0
9045,17974285,1988319,"   

That is a bullshit response. So if I saw a rich old lady in her Ferrari with (just for say) 100 k in the passenger seat its ok to steal from her because she has the money to lose? NO, stealing is stealing no matter what the scale of it is.

I know its not the best example but its just what came to mind.",0,0
9046,17975127,1988757,"-Not to seem paranoid , but i have a few q's , because when i start i wanna know everything in to out .

-Is it okay to fake meets ?
-Should I use pay-pal if so how (transfer money to my real account?)
-I have my sites in order , but can i get reported on Craigslist ?
-what she be the max amount of payment i should take ?
-Can i pose as a girl my age (younger lol)
-Have you ever ran into any conflicts , like talked to Chris Hansen lol ?",0,0
9047,28181188,3029766,"I have: 

3 various emblem codes

1 Forrest Armor code

1 Arctic BR Skin

1 limited avatar prop code, and 1 avatar pre-order prop code

1 male and 1 female Limited edition avatar codes(Spartan 4)

1 48 hr. trial - SOLD

PM if interested.",0,0
9048,16042240,1765179,"   

thats good plus if u have a girl around its easier to ewhore because they can guide you",0,0
9049,18197812,1765179,"figured its mostly guys, i am a female and it def. has its advantages    ",0,0
9050,16042223,1765179,"im male but i usually do most of my hacking with a girl , were a sorta team lol so when i e-whore i just call her..",0,0
9051,16042189,1765179,true but i saw 2 females learning how to ewhore tho they dont really need practice since their a female but curiosity :D,0,0
9052,51133733,5290316,"GT: Sh*jo

a genre of Japanese comics and animated films aimed primarily at a young female audience, typically characterized by a focus on personal and romantic relationships.

Offer me. Message me if interested.


BTC/WU Only

or trade for a dope GT",0,0
9053,26896391,2903814,"Vouch for my baby Mew, he puts little girls in his trunk.",0,0
9054,51109400,5288028,"I have one, lmk if you're interested. It's a pretty common girls name.",0,0
9055,51107614,5287835,"1. SOLD :)
2. S*pz
3.T*tz
4.G*mble ( simpsons character ) Not gamble
5. G*ssamer ( Loony toons character )
6. S*ndy ( Popular girls toy )
7. R*lz ( RAPPER )
8. R*ckz


Not trying to get much at all. Hmu",0,0
9056,53111238,5464435,"   

Irony? You cant even get hired so you pretend to be girl online!! LMAO socially awkward much?",0,0
9057,51567221,5327946,"I wonder what kind of female needs to use a dating application to find a guy.
Simply go clubbing and find one, that's what girls here do.",0,0
9058,51567188,5327946,Damn bro this sucks to hear. But that's Tinder for you and that's why I don't trust it. I'd rather just meet girls in person than any of those apps.,0,0
9059,41206263,4336792,"Would hate to get called a pedo when I'm masturbating to a 18 year old girl when I'm like 30-40 years old.

/facepalm",0,0
9060,41206237,4336792,"So your problem is the world ""Pedo"" in the title :/ many users have use it not literally, like i did :/
And im pretty sure, if a 40+ yo guy want to have sex talk, exchange nudes etc with an 18yo girl then he wouldnt have any problem doing that with a younger girl too :)",0,0
9061,41206176,4336792,"lol ur right, but if they cant find a <17 yo girl then im the next best option they have :P",0,0
9062,48482839,5049548,I know of a little girl named Jan who does,0,0
9063,17891235,1973008,"I heard that the skys the limit I came from the real world to your site because I have heard of people making 5grand a month. I would guess if you have good pick up skills a person could make 1000 a month not doing much. I have never did this yet but have seen real girls do it and make a lot and have heard of others killing it. I'm hurting so here I am lol. It is rumored that there are many skilled ewhore raking in over a 100,000 a year I honestly think thats probaly accurate.",0,0
9064,17885635,1977677,"1) I PCs battery ran out while cam ewhoring
2) A guy shoved a hair brush up his ass
3) I E-Whored a female, Yes a female and not a guy or bisexual.

Not in order and don't remember some",0,0
9065,17909375,1981121,does anybody have pictures of girls with paper so you can photo shop it to make the slaves name appear??? thank you :),0,0
9066,46292464,4836397,"Hot damn, these things are rarer than a 15 year old white girl that hasn't tried Starbucks.

GL selling this OP!",0,0
9067,41193114,4335449,"That girl is old, it's probably saturated by now. Good luck on your ewhore.",0,0
9068,41196754,4324910,"When i started i actually used the pink girl room VCW and it was making me money until the Youtube video went viral. 
I normally would infect them & complete the short show that pack offered then just before the show ended id disconnect there internet. Did that once or twice when they cameback and eventually SE them with promises of a show 'next-time', Nowadays is much easier because you can just get a resolver and boot them offline.",0,0
9069,41194981,4335449,You can get more girls by buying packs off members,0,0
9070,17913785,1981154,"Well written I can;t be fucked with a proxy any more, its fucking pointless anyway if the police come to my house just put it straight, rather have some epado paying for a fake meet and lsoing £50 than rather have the meet a girl rape and kill them or something.",0,0
9071,51060011,5282264,Damm baby girl some nice ish you got there,0,0
9072,48652121,5065809,"   

Not sure how you being a female dog is relevant but kk",0,0
9073,17898787,1977730,"'hi mr police man i was paying a girl on the internet to show me her tits on cam and she wasnt really a girl wut do'

honestly don't worry, the mark would be too embarassed to even do anything",0,0
9074,13401939,1461276,"I feel for you man, but think of it this way... You are teaching pedophiles a lesson! If thats a handful less girls getting raped then you have done good in the world!",0,0
9075,41192902,4335424,"Only part of Craigslist is for that. I wouldn't suggest you post that you're a girl looking for fun in the ""selling a boat"" section, for example :P",0,0
9076,41192879,4335424,"Post an ad saying you're a girl looking for fun blah blah, then they'll email and done.

Craigslist is a place for sexual encounters and other stuff.",0,0
9077,50443614,5216891,these girls look like legit dirt,0,0
9078,48665621,5066208,"Aka any female muslim lol

   ",0,0
9079,53196841,5472488,"Hmm, I played sad girl and he sent me another 25 but on paypal this time with his credit card  ... So maybe he wasnt lying and amazon gift comes eventually after a few days.",0,0
9080,45583380,4765918,"Selling SICK Female Name instagram. 

@*ADIA
Hint: Really Name

It has 2.3k legit followers. Gets a day 10 to 20 followers maybe more

Open to offers.
C/O: $70 - @Ruins

Only btc

No BIN, ill be taking offers and if I get one I like I'll take it, but if not i'll just keep it.",0,0
9081,48650390,5065113,Alot of girls in my city wear these and i must say they are sessy.,0,0
9082,48656293,5065113,"   

No, they aren't. No girl in their right mind will want to dance with a man wearing light up sketchers. 

get the fuck out of here",0,0
9083,48654392,5065113,"   

well, he didn't say ""women"" so technically still fits the bill!",0,0
9084,48654017,5065113,You'll get all the girls to flash along side those LED's,0,0
9085,39310539,4154562,"   

You have a pic of a girl holding a piece of paper ?
You can PM me the pic and i'll give a try, if you like it i can show you how i do it.",0,0
9086,39307903,4154562,"Looking for a good guide on how to photoshop names on like a girl holding a piece of paper or if you are able to do this and do it well please contact me, thanks.",0,0
9087,28130906,3024549,"I'm selling my adfoc account with balance: Total Earnings: $94.9654
Selling it for $70.
✔Need money for advertising✔ THEY HAVE PAYOUT ONCE IN MONTH BUT I NEED MONEY NOW!

Proof will show on teamviewer.
Contact skype: loud.girl
Only serious buyers, scammers GTFO    ",0,0
9088,48649661,5065113,ive seem some of them but it was a a girl who was fit and could dance with them so on a guy i dont know what to expect but i dont think its good,0,0
9089,17858130,1975196,"Try to look for a asshole on chat-ave,tell them you are a girl up for phone sex,get their number, tell them your sending a code to verify, get the code and verify it.",0,0
9090,53167727,5469991,"I've got one guy who keeps buying from my ""friends"". He's bought 4 girls worth of pictures, $100 each.

Just wondering what your guys' experience is, and how fucking clueless your customers are.
				
				
				

   ",0,0
9091,17824806,1971456,"About as ""awkward"" as pretending to be a woman online if you ask me.",0,0
9092,46138806,4821817,"Its currently at 40.2k followers the niche was for ewhoring and to get girls to send nudes it comes with the snapchat also that gets nudes and over 1k views

it will come with the twitter and snapchat as a combo 

Bid:
Bin: idk yet make offers",0,0
9093,17796803,1968425,"so i need a ewhoring pack with multiple girls, ages, races and all that
so just a huge pack full of varing girls
i cant find any and i need a like some asian girls in it and diffrent types so i can effectively ewhore#if anone has one can you pm me please ?",0,0
9094,48656878,5066294,I farted in the tunnels under my school. We made this girl freak out and cry. High school...,0,0
9095,41146700,4330848,"i know a indian who spend 300 buck in a strip bar, but just on drinks for her! they was sitting on the bar and talked for 2 hours, he told us that she was a poor girl and just for that he did that ;)",0,0
9096,1113362,119576,Holy fuck that's not cool.  There was one girl that looked like she was 8 years old  0.0,0,0
9097,17768156,1962397,this girl is all over the internet. using her to e-whore will guarantee failure,0,0
9098,17788036,1967446,"Hey, has anyone got two pics of the same girl but I need one of those pics with cocks in her mouth, got some guy saying he will buy but he needs a picture with cocks in her mouth, please PM me.",0,0
9099,17742005,1962397,"hey i wanna know what the name of that girl is
   
my friend now who she is but he don't tell me",0,0
9100,53013744,5455844,"I need a faceless picture of a blonde girl holding up 3 fingers on her belly.

If the picture meets the figure of my ewhore, and when I send it to the client he believes it and wont ask for the girls face in the picture aswell, I'll pay you.

PM me
				
				
				

   ",0,0
9101,48658958,5066091,"   

If you're female, don't forget to wear your burqa while you're out there.
OT: He's a rich motherfucker.",0,0
9102,17730286,1961111,"Are these legal...? I just downloaded some packs and some of the girls seem questionable... Are you all behind 12312312 proxies, seriously..",0,0
9103,41146011,4330992,"I have a lot of videos of this one particular girl twerking, pretty HQ. I would give them for free obviously but would anyone even be interested?

Edit heres the link:    ",0,0
9104,48657753,5058899,"   

This guy still believes in GIRLS LOL",0,0
9105,48592009,5058899,I just want a real relationship with a real girl who knows how I feel and that I can talk to.,0,0
9106,48578862,5058899,"   

Woman weed and weather. Los Angeles is beautiful. So expensive though",0,0
9107,52992456,5454003,"I don't get why people put x at the end, I've never met a girl that texts like that. It makes you seem fake if you had ""xx"" at the end each time.
				
				
				

the world is yours",0,0
9108,46444226,4850808,"lol i was doing nothing here when i picked up thi steam and lol the guy have 154 games kk :
   

   

   

   

   

lol arelady change email and password if anyone is interested....",0,0
9109,48578781,5058899,"MY main is improve my social life.  Get tons of girls in my life. Overall be self developed and type of person which people model.
Though i still lack motivation",0,0
9110,48658348,5066410,"Easy bro all you gotta do is force yourself. If you're out and see a hot girl or someone you want to talk to, but feel shy, simply force yourself to talk to them. Eventually you'll get used to doing it and feel comfortable.",0,0
9111,52951729,5450190,"Just search on porn websites for 60+ pics of a random girl (at least 2 clothed and some ""casual"" pics too)",0,0
9112,52953732,5450522,spanish girls are cute afff,0,0
9113,52950292,5450139,"lmao its fucked cause hes gonna lose his maybe only real girl now
				
				
				

   ",0,0
9114,52950423,5450139,i mean you ewhore do you really have feelings for them you are pretending to be a girl to get money from him?,0,0
9115,52951517,5450139,"damnn thats crazy haha, part of you must say poor guy, but fuck him, he shouldn't be talking to other random girls and paying them for nudes when he's married and probably has kids.
				
				
				

   ",0,0
9116,52953094,5450418,You could just search a cam girl and zoom in the vid in an editor so you don't see her face,0,0
9117,52950354,5450153,"Hey guys,

I need 2 videos from a girl without face for a customer. Is there someone who can helps me really fast?

Thanks!

Skype: xCSGODUde
				
				
				


""Yeah, it's funny that you got a lotta money but that money doesn't buy you skills, though""

   ",0,0
9118,52948786,5449982,"Ability to convince people you're a girl is the key here. You can have the same resources and the other person and one will make hundreds, other one nothing. All about the social engineering.
				
				
				

 Buying Amazon.com Gift Cards for Bitcoin.  ",0,0
9119,52931677,5448368,"Check on adult websites, some girls have a ton of pictures. Including some that can contain verification pics. Another way is to find a real cam girl & offer her some money to pose for you and such.",0,0
9120,52875292,5441820,Kik is going to work almost always unless something incredible happens like no female kikers.,0,0
9121,48658196,5066410,"just remember, girls like assholes. and to be an asshole, you have to be confident.

also most girls (were talking about hot, kinda slutty ones, right?) are really shallow and wont like you if you arent wearing nice clothes.

i noticed that when i got a bunch of tattoos and started wearing lots of really expensive jewelry, more girls even try to talk to me! proof that these chicks are shallow",0,0
9122,52861792,5441584,"There are some good tutorials out here. Make them believe you are a real woman, and make them pay for ""your"" pics.
Once you get the guy's trust, you can make him send gift cards to you or whatever.",0,0
9123,41119039,4328201,"   

thats your problem think about it why would a girl sell her self so cheap ? make your prices alot highe

i use a private vcw and yes i give the the show i charge 20 min shows £25",0,0
9124,52760453,5432539,"   

Hey girl I'ma need a little teaser to know what I'm buying. nomsayin?
Don't block yet. promise I'll send 500 amazons right after.",0,0
9125,52761232,5432539,"Idk why you'd waste your time telling HF ;)
If you are legitimately a woman, use yourself to get verified on the big subreddits (or other sites), & use a pack that is similar to yourself... then sit back and enjoy making bank :)
				
				
				

   
Sign up through this link and PM me for small bit of help",0,0
