Unnamed: 0,IdPost,Thread,Content Cleaned,Label,Sentiment,0 Mistakenly filtered,1 Sex,2 Relationships,3 eWhoring,4 Online crime,5 -Descriptions,6 - Abuse,7 - Politics,8 - Skills,9 -Story
1000,58961733,6008738,"Yeah, I get this trust me.

No joke I've had so much drama go on behind my back about me. 

Perks of dating a girl who was kinda popular and knowing so many different friendship groups.

I felt much happier when I moved away from the area and made a new group of friends and didn't over-extend it, just stuck with people I knew were nice.

Honestly, who cares if people are versus you? Just do your own thing and be nice to everyone, even people you don't like. Honestly be nice to them and you'll feel better.",2,P,,,,,,,,,,
1001,58988085,6011134,"Now we are about to have Travelling in Britain and the geography

Anything I should be aware of? Is there a way I can trick the teacher? I don't like her too much, she's not native or anything.
Just a woman who learned English and now teachers it in school.",0,0,,,,,,,,,,
1002,58986125,6010337,"Holy Clay Davis, this is the definition of inflated hypergamy at its finest.
10000 males for 1 girl
LMAO.",2,0,,,,,,,,,,
1003,58975078,6006848,"It's alright OP I was trapping for a couple years but blowing thru my money on drugs and other stuipid Clay Davis and never was able to save a dime. 
Then I stopped taking perks and started managing my money better; After 3months I had 1k saves up so I bought a Bike (2019 SE marshawn lynch Beatmode) for $900. Then i ended up putting a good $500 into it, the bike was fugging awesome man (Looking for pic)
Spoiler  (Click to View)  
   


Too fkin nastyyy: (in between two poles ;D)
Spoiler  (Click to View)  
   

So I went to NY to chill with a girl from tinder. It all went wrong when I bought my tickets and the train wouldn't let me on because ""rush hour"" like alright. So i ended up sneaking on the train and got kicked off at the next stop. So while I was sitting at the next stop I asked some dude if he had some perks, and of course the devil came into play, and he said ""no but I got some xans""... (I've had a serious problem with xans)
So i ended up buying 3 bars and instantly took all three. 
Skiping to where I finally was in NY for a couple hours and was looking for perks again (still off the xans). I met some dude was chilling with him for a while and got my bike stolen. 

So OP this is one of the many kick in the balls I've had n my life. Keep your head up and keep pushing cause life doesn't stop for nobody",0,0,,,,,,,,,,
1004,58988105,6011138,"   

Plot
Hundreds of years in the future, in a colonized Solar System, police detective Josephus Miller, born on Ceres in the asteroid belt, is sent to find a missing young woman, Juliette ""Julie"" Andromeda Mao. James Holden, Executive Officer of the ice hauler Canterbury, is involved in a tragic incident that threatens to destabilize the uneasy peace between Earth, Mars and the Belt. On Earth, Chrisjen Avasarala, a United Nations executive, works to prevent war between Earth and Mars by any means necessary. Soon, the three find out that the missing woman and the ice hauler's fate are part of a conspiracy that threatens humanity.

Trailer

   


In my opinion this TV show is one of the best I've ever seen. The amount of detail and effort that has gone into this show is incredible.
The Expanse has now been taken over by Amazon who will hopefully continue on the series for at least 2 more seasons.

Season 4 is airing December 13th 2019 only to Amazon Prime Video.
I would highly recommend watching this series if you already have not.

If you have, I'd love to hear some feedback on what you thought of the series and some of you favorite scenes, characters and episodes.

WARNING: Spoilers will most likely be posted due to discussion of the series.",9,P,,,,,,,,,,
1005,59043385,6015579,"Stop adding bitches, straight up. Women report premiums 10x more than dudes and also never buy Clay Davis. Trust on this. 15k+ for me and not even a warning. Or your traffic source is real low quality with people outside US/UK.",4,N,,,,,,,,,,
1006,59042824,6015579,"Hey guys I am worried about getting my snapchat banned it has 20K viewers so far and would hate to see my hard work go down the drain. 

I am not posting any nuditity on my stories so it's safe right? 

and on the story i do not post one ewhore girl, i post compilations of girls and they know I am not the girl. 

how can i make sure i am safe??",4,0,,,,,,,,,,
1007,59052762,6016258,"I really don't know how to this lol but as the title states by my own vouch im a real girl and since every girl like me is retarded and doesnt know how to whore properly im looking for a partner/wanting to hear any offers someone might have for me

add me on discord Kitty#9886",3,N,,,,,,,,,,
1008,59052601,6016246,"I have tried my dip in Ewhoring and I've found NO success till now. I have spent more than 2 weeks talking to guys, searching packs, looking through guides but it just doesn't seem to work. I also have a girl who's there to send me pics or verify. I've tried my fair share of methods from Kik to Snapchat but no luck. 

Thus I'm looking for a mentor or a partner to take our career of ewhoring to great heights. Message me if interested and we can talk. 

Hit me on discord @ RYUKENSFJ™#8973",3,0,,,,,,,,,,
1009,59051991,6014429,"   
Nice and all but how much time do you spend talking to them before they buy? The worst thing about e whoring imo is putting 5 to 30 mins into a conversation just to get nothing in the end. That's why I'm in and out. The real buyers understand this and aren't looking for a friend or therapist before they send the payment.
I'm curious about what crowd you look for if it's not the picture & video guys since you sell off Kik.
I just sell off Kik I don't want to download programs on my computer to animate a human body to do Skype/cam sessions and I don't know anything about Snapchat so I stick to selling pics and videos of the girl on my profile. It was very lucrative for a long time with multiple buyers daily/weekly up until this year when everything slowly died on Kik. At this time I'm lucky to find 1 new person a week using kikfriender now.

A normal conversation goes like this -
So called buyer: ""prices / how much""
E whore: ""blah blah blah""
So called buyer: ""what do I get for 25?""
E whore: ""blah blah blah""
So called buyer: ""I'm in. What's your payment info?""
E whore: ""blah blah blah""
So called buyer: ""I've been scammed before can I get 15 titty pics while I send the money""
It's either this or they ghost you before they send the payment. 

They are all like robots and write the same thing and try to fugg you over in the same ways. It's like a playing a video game to me.",3,0,,,,,,,,,,
1010,59045892,6015754,"   
Your prices are way too low. You just really, really need to think about it. Try interacting with girls yourself online. How would you feel if some random girl was offering five pictures of herself a few minutes into a conversation? You need some real high quality, gullible retarded traffic sources for that to work. 
I'm by no means a pro at this but I have seen how real girls do it. They have a following, they show their life, they are real people. There's so many young guys that look to get into this but don't even have the experience of communicating with women.",3,0,,,,,,,,,,
1011,59045823,6015754,"   
Everything is just saturated to fugg at the moment. The 'help the poor girl' line isn't going to work unless you build a rapport with them first. How many vanilla/clothed pictures do you have? This is important too. You, personally; if you were ever to buy nudes.. Who would you be more likely to buy from? The hot girl posting regularly on Snapchat about her life who is now selling nudes or some random from a chat site? As I mentioned, it's saturated. Literally thousands of people are doing this. If you don't have conversational skills, a HQ pack with lots of pictures or a real girl, it's not impossible but it's going to get very tiring very fast.",3,0,,,,,,,,,,
1012,59045787,6015754,"I think the fault lies with the fact you said ''""Hey babe, you know what? Since you are sweet gentleman, I offer you a boob pic for 10$ or 2 ass pics for 15$.""
Rajeev, you went full on Rajeev! No woman talks like that man.",3,0,,,,,,,,,,
1013,59051036,6016078,"   
But she as a girl can't utilise her full potential, also most girls dont have patients and skill to do ewhoring lol",3,0,,,,,,,,,,
1014,59050672,6016078,make a snap account > go onto reddit > verify ur girl on r/sexsells or r/premiumsnapchat > post what u offer there > profit,3,0,,,,,,,,,,
1015,59050395,6016078,"Hey guys, so I have come in contact with an old friend of mine who's a girl and she's really desparate to make some money. I told her about e-whoring and how people make loads from selling fake nudes, and how she could sell hers for money, and she's 100% on board with it.
Problem is, where do we start? What sites should we try and what methods do you guys recommend?

PM me or reply with whatever advice you guys have, and she said she's only not okay with face pictures. She's scared of having her identity leaked or spread.
Any help appreciated, thanks!",3,0,,,,,,,,,,
1016,59052308,6016229,"Hello fellas,

As I got into E Whoring last year and failed miserably first, I decided to get my hands on a real high quality E-Whore pack and paid a girl 200$ for making a pack with also verifications for me.

I made this girl to my main income source, as I learned from my mistakes and made my own strategy, if you wanna get hands on it, contact me at Telegram @hustlep99",3,0,,,,,,,,,,
1017,59050004,6016054,"Good day

Im on E-Whoring since 6 months now and made 600 daily last month with a very hot young girl from Europe.

If you want to adapt my technique and be ballin everyday write me on Telegram @ape66

Lets make bread",3,0,,,,,,,,,,
1018,59047614,6008211,"Not sure if you two are still planning on releasing this, but I think you should. I remember you both from back in the day, and I remember Kashira personally being very knowledgeable and helping me. This whole section has gone to Clay Davis, along with everything being sold regarding it. Some guy was selling a pack on here of a girl with like 4 million insta followers not so long ago, hopefully what you planning on selling will be HQ and will actually help people.",3,0,,,,,,,,,,
1019,59045779,6015746,"   
Make her wear a mask then name your ewhore girl with a superhero name",3,0,,,,,,,,,,
1020,59045646,6015746,"Hi guys, i have an real girl pretty hot, i was wondering if i can verify myself on reddit using her, she's willing to do anything but not showing her face. so what if she makes all requestes they ask for verify but putting an emoji over her face? mentioning she dont wanna show her face public? she can do absolutly anything including vids verify.",3,0,,,,,,,,,,
1021,59037950,6015196,"   
No i won’t fugg all dat, because i actually work with real girls so some kind of professional websites or services would come in handy because customer won’t ever ask for verifications anymore.

Also i find that setting up an own Website and implementing recurring payment API’s is not as clean as those websites when it comes to selling. 

Does anyone have experience with CCBILL or similar service?",3,0,,,,,,,,,,
1022,59040285,6015356,"   
It's not optimistic whatsoever, not all girls are looking to make it a career and send their ID. There will be a demand for non-verification websites, and someone will shoot their shot.

+ if she's making the same as she did whilst with you, you weren't doing anything for her lol - you were benefiting of her not the other way around.",3,0,,,,,,,,,,
1023,59040204,6015356,"   
Optimistic, but what happens in the off-chance thats not the case? What if she does end up making it? I know a girl that just started getting into it, and got help from a girl who's a PH model.",3,0,,,,,,,,,,
1024,59040172,6015356,"Working with female partners is expensive and a pain in the ass. Most ewhores aren't going to have the patience to do it. The sites with complex verifications are actually driving real women away too. When traffic goes down, they'll make changes. 

If you know what you're doing, she will never cut you out. And if she does, when she doesn't make as much she'll have to come back.",3,0,,,,,,,,,,
1025,59029504,6013062,I feel like the raise of incels has made this more profitable. Paying women makes them feel empowered from what I have read.,3,0,,,,,,,,,,
1026,59038192,6014445,"   
easiest scheme i could give u is...

go on twitter search only fans find a girl whos not popular but has a lot of Clay Davis up 
buy a snap from playerup idk if hackforums offers this im new here 
they can get u 50k snapscore for like 5-10 bucks so it looks more legitimate 
make a tinder with her pictures with snap in your bio say you're looking for nsa fun
id say get tinder gold and match everyone a pretty girl can get 2000 matches in a week or more swipe everyone 

now the tricky part guys get mad when u dont wanna fugg them and try to sell videos... they'll report your account iin droves and your tinder can get deleted quick
i say get a bunch of matches and adds then deactivate it yourself then come back 
use tinder gold go to a new city and do it all over again

then sell dropbox links of the girls content lol promote video previews continuously 
if dudes try and ask for proof say i have a high snapscore do u want the videos or not im not here to answer every guys verification request 
that'll work 50 % of the time",3,N,,,,,,,,,,
1027,59034338,6014905,"MHM, just need some comeon sense bro, dont need a guide to be told things what you know. You ever talked to a girl that was a hoe and got things from you? 
just need to be that (Fake girl) and turn ""gay"" HAHAHAHAHH",3,N,,,,,,,,,,
1028,59034488,6014905,"   
its just facts, Clay Davis, but girls got an advantage at getting whatever they want, only some see i feel",3,0,,,,,,,,,,
1029,59024889,6013604,"   
   
lol @ these people who says ""dont worry about traffic, its all about SE"" .. 
as first, im not kid, im turning into 30 soon, secondly i never had day where i earned 20 or less bucks on ewhoring..
during my ewhoring ""career"" i had a lot of sugar daddies who was giving me any ammount of Money i have asked for.. and i still have to say its ALL ABOUT TRAFFIC! 
traffic is generating contacts requests which consist of:
1. broke guys who doesnt even read text of your post and all they want is jerk off for free on some free nudes.. or some bored kids who just acts like buyers, ask for vertification but all they want is free attention from some girl online (70-90 percent of adds up to your traffic sources)
2. buyers - people who read your post and they are willing to spend some $ for nudes.. usually they have buy-limit and after they deliver their product and cum, they dont care about u that day.. (0-30 percent of your adds, up to traffic sources)
3. buyers that are milk-able - guys that fell asleep time and was never scammed before in 2019..they are gonna send Money to someone they will never meet in real life.. (0-1 percent of adds)
MOST OF guys are not even able to spend any cent on some nudes they can find for free online..most of buyers are just horny men who wants to cum on something fresh and they are not that stupid to waste their Money on some illusion!
YOU CAN milk some type of customers but you cant build your business plan on it.. once all your sugar daddies will be gone and u are not focusing on traffic, you will fall to bottom in day (happened to me before)..
$500 day ? where you heard that? in some ""e-book"" ?       it was possible in 2012 when market was unsaturated and selling nudes online was ""new thing"".. i dont think there are many people who makes 500+ daily on regular base, maybe 0,00001 % of all ewhores who use black-hat techniques and bots..
and OP asked a good question: 
how do you want to milk guy with nickname ""HORNY BOY"" who writes ""send nudes pls"" as first message? and dont tell me bullsnap like ""think outside the box"" etc. because that magic technique doesnt exists!",3,N,,,,,,,,,,
1030,59028255,6014437,"My main goal here is to create a network of 6 experienced e-whores.


Prerequisites:

*1 year of experience 
*A girl of your own for organic photo's 
*Have made at least $1000 e-whoring 

Abilities we're looking for (not required but will help during selection):

*Javascript, PHP, HTTP, CSS
*GFX
*CPA, PPC, PPD
*SEO
*Affliate Marketing

I will create a discord for this but if you're interested DM me.",3,0,,,,,,,,,,
1031,59028426,6014450,Hi does anyone know any good sites with webgirl rips on file hosts?,3,0,,,,,,,,,,
1032,59027606,6014223,"   
Or if he is actively working with a girl and has full permission.",3,0,,,,,,,,,,
1033,59025237,6013732,"There's tons of ways.

I have a friend that uses vysor with an android and has a macro set to run every 24 hours that saves everything from a girl's story.
I know people have bought/created instagram ""modeling agency"" accounts and hit up girls on IG offering to pay $400-$1k to make them a pack
Tinder works fairly well actually if you're near a college town. Bitches will do anything for a bit of dough

Just get creative ;)",3,N,,,,,,,,,,
1034,59024764,6013732,"some will just save posts real girls make on their stories, probably time consuming as fugg, but they can easily make like a grand doing it. pretty good return i guess",3,0,,,,,,,,,,
1035,59018607,6013732,"I'm in need of a new one and i wonder how people do it, pornstars or camgirls usually have too prof pics.",3,0,,,,,,,,,,
1036,59016066,6013503,"   
Well sooner or later they will start using it.
Take a look at reddit , twitter. All of these girls are asking their customers to move to telegram.

Some guy even gave you a link above.",3,0,,,,,,,,,,
1037,59021201,6013869,"I put together a list of sites a while ago with the intention of making it into a nice shiny guide and selling it after milking the sites myself.
However, I had a real girl let me down and didn't want to waste accounts/time with a free pack.
I would be prepared to sell the list to a few people at a reasonable price, as long as people keep it to themselves and don't share it with their Discord buddies.
E-whoring really isn't for me but I would come back to it as a middleman for a real girl.",3,0,,,,,,,,,,
1038,59021104,6013923,"So I want to subscribe to a few premium snapchats to ewhore with them, and also because I find the girls I'm interested in hot. However, if I were to screenshot their pictures the username would appear in the top left corner. This would be useless to me in the long run. Does anyone know if there are any apps to straight up rip the image without the username watermark showing up?",3,0,,,,,,,,,,
1039,59016561,6013568,"   
Hi can you please send me girls 1s pack. Thanks alot in advance!",3,0,,,,,,,,,,
1040,59014857,6013200,Biggest mistake i seen 100s of noob doing is Not focusing on timewaster and Not being creative to customers like be Chearfull on your chat talk like girl not like some dump ass teenager guy,3,0,,,,,,,,,,
1041,59012156,6013200,"I just started recently and made tons of mistakes, starting out with some hot girl from Insta and not having single nude pic for almost month, not paying attention on time of the day while posting live, lying about too many things and messing what I said to too many potential buyers where I probably lose money bc half assing and giving contradictory info on simple questions, wasted eons trying to convert wrong guys etc.",3,0,,,,,,,,,,
1042,59010609,6012925,"This depends on the platform really, and on your knowledge of Ewhoring itself, and of the platform you are using.

I don't know which platforms you used, but I can assure you that Ewhoring is still not considered ""hard"". Time consuming until you get a grip of new platforms - yes, hard? - no.

I haven't used SC yet, so I don't know about multiple phones, but I'm 80% sure that one phone is limited to one girl only (someone correct me if I'm wrong).

When I started, I used one girl until I got all the basics (and not so basic stuff), then added the second ""girl"". Now I'm at the count of 3 with 4 ""retired"" ones. Why did I switch and ditched those retired - simple - they got too recognized or they stopped ""modeling"" in their real life so the sources got dry af. Also, no matter how weirdly this sounds, you gotta get used to a girl you are using, I had one pack, I think most of the guys here would die for a pack like that, and had to ditch it. Why? Because I simply couldn't manage to land a dime with her, even tho the packs I use now are far worse than the one mentioned. 

One of the girls I use is 2 and a half years ""old"" and I think it's still not time for her to retire. So that question can't be really answered - it's all up to you. 

I hope I helped.",3,0,,,,,,,,,,
1043,59008945,6012925,"hey i was just wondering im getting back into this after a long hiatus. 

its much harder than i remember this being (lol) and i was just wondering do you guys
ewhore multiple girls at once or one at a time

and if so could you tell me whats the process like and how do you manage the whole operation multiple phones/traffic/messaging etc. or if its better to focus one account?

and when do you decide when its time to ""retire"" a girl or switch to another ewhore 

thanks",3,0,,,,,,,,,,
1044,59011216,6013104,"Definitely a service that would be very valuable to a lot of people, obviously depending on what the girls look like.
However, with limited account history people are always going to be sceptical.
Would be open to a loan deal of sorts and would provide updates and vouch for your service. 
GLWS.",3,0,,,,,,,,,,
1045,59010966,6013104,"Hello guys,

For years I was doing pictures for a guy and he would pay good for the photos and use them to ewhore and made over 10k a month off of the pics

I’m gettin back into it and will start a shop to sell customs photos 

PM me if you would like this service. I have multiple girls that will take requests or I have past girls I have done! Pm me on here or kik: 3h4",3,0,,,,,,,,,,
1046,59009803,6012920,"   
You basically start the same way like you would on kik. The medium is not as essential as the act itself.

I can hook you up with Snow, the original dev of this snapchat tool. I go with his tool because i like to work with solid partners and he’s one of those. 

As far as autobuy, i’d recomend selly for example if you don’t mind paying fees. I did setup a few of those shops and got some sales but i like it more to sell other creative goods besides nudes since my nudeselling is mainly via seducing.

Autobuy is recomended if you got a famous girl working with you or got some clean traffic source where people are interested in buying nudes.. otherwise i could not handle the processing and redirecting everyone to the store manually. 

Also i’ll say it everytime. Setup 5 paypals, when one gets liquidated setup a new one.
Always send funds to your main either f&f or funnel it through your online shop by buying goods of your own store. You pay fees but in the end of the day it’s clean and you can tax it.",3,0,,,,,,,,,,
1047,59009337,6012920,"   
When we talk about social media like instagram, try to have a pack with alot of irl pics of her daily life aswell as teasing pics. 
Alot used bots when it worked but since some stuff got changed i can’t see that many around. But the classical “follow/unfollow” method would work anyway. 

So start off with your profile;

- Attractive Profilepic (Clickbait)
- Profile set on “Private”
- Post pics wisely and don’t spam 50 in a day
- Bio is kinda important because it’ll make people remember you. Have a look @ the top earning ewhores (real pornstars) on instagram.
- Don’t spam hashtags, use 3-9 maybe to look like a girl once in a while.
- Start following girls of the scene and regular people.
- Like & Comment. Best way is to really look at their post, look at the description & comment section. Then you use some creativity to actually make a connection to people.
- Unfollow regular people after they followed you.
- Keep making posts with questions or tasks. “What would you do?” “How do you guys feel about that?” 
———

If you built your instagram you’ll never need to worry about snapchat traffic either. 

If you only want to have snapchat traffic then i’d suggest to signup under all dating apps, make 1-4 acc on each app. Setup a profile, smash your Snapcode in your profile album and your Snapname in that dating bio. 

Just examples of course, there is really alot of ways to find people of all nations lol",3,0,,,,,,,,,,
1048,59010576,6012958,"   
1. It really differs from a person to person.
2. It's not the count that matters so much, buyers tho - they are worth a lot when you know you have them in follower base.
3. You block them. Period. I use a girl that's 6m ""famous"" on IG and even PH and I still manage.",3,0,,,,,,,,,,
1049,58454076,5958699,"Hey, I am a 21 year old college girl who is tired of dealing with creeps online. I will cater any set of pictures to your liking for a price that we can discuss. contact me if interested.
can provide verification once messaged thanks!",3,0,,,,,,,,,,
1050,59005841,6012327,"   
Hi, I'm a girl and I sell voice recordings.

£3.50/30 second recording or £50 for recordings whenever you need for a month.

add my disc if u wanna chat Kayleah#7346",3,0,,,,,,,,,,
1051,59005278,6012327,"their are voice changing app which works good ,  i mean finding a girl and paying her is fine but not feasible , if you dont have that deep voice you can try your luck with those apps",3,0,,,,,,,,,,
